,product_name,product_category,price,product_images,product_description,product_benefits,product_details,productdata_content,other_colors
91,Jordan Series Mid,Men's Shoes,SAR 625.00,"['https://www.nike.sa/dw/image/v2/BDVB_PRD/on/demandware.static/-/Sites-akeneo-master-catalog/default/dw64cd061f/nk/113/2/8/4/4/4/11328444_95a0_4d34_9f6c_2091f4ddbbc5.png?sw=540&sh=540&sm=fit&q=80', 'https://www.nike.sa/dw/image/v2/BDVB_PRD/on/demandware.static/-/Sites-akeneo-master-catalog/default/dw3fda5213/nk/277/d/9/d/6/6/277d9d66_90c4_456b_9483_d7a734706f30.png?sw=540&sh=540&sm=fit&q=80', 'https://www.nike.sa/dw/image/v2/BDVB_PRD/on/demandware.static/-/Sites-akeneo-master-catalog/default/dw29ef2a89/nk/aff/e/7/4/a/0/affe74a0_bda0_43dc_ade7_f1d9334334d5.png?sw=540&sh=540&sm=fit&q=80', 'https://www.nike.sa/dw/image/v2/BDVB_PRD/on/demandware.static/-/Sites-akeneo-master-catalog/default/dw58e891a0/nk/602/e/4/7/a/3/602e47a3_5943_406d_afaf_e1ddddbeba41.png?sw=540&sh=540&sm=fit&q=80', 'https://www.nike.sa/dw/image/v2/BDVB_PRD/on/demandware.static/-/Sites-akeneo-master-catalog/default/dw3e24a688/nk/5d0/0/0/8/f/8/5d0008f8_67f3_45c6_9116_f633a34e3777.png?sw=540&sh=540&sm=fit&q=80']","Classic meets modern in this fresh take on a Jordan Brand essential. Durable leather and suede are bolstered by lightweight synthetics for extra support. The iconic midtop silhouette is more breathable than ever with a perforated sockliner. Plus, inspirational messages nodding to MJ's origin story are incorporated into the design, adding meaning to every step.","['Premium leather and suede are bolstered by synthetic materials in the upper.', 'Plush foam on the collar hugs your ankle for easy wear and comfort that lasts.', 'Adaptive-fit eyestays are designed to move with your foot as it bends and flexes.', 'Rubber foxing bolsters the heel for those days when you need to casually kick off your shoes.', 'Vulcanised rubber wraps the midsole for a clean, off-court look.']","['Perforations on the toe', 'Rubber outsole', 'Woven Jumpman label on tongue', 'Colour Shown: Obsidian/Sail/Sail', 'Style: DA8026-400']",,[]
92,Jordan Series ES,Men's Shoes,SAR 550.00,"['https://www.nike.sa/dw/image/v2/BDVB_PRD/on/demandware.static/-/Sites-akeneo-master-catalog/default/dw1992e0f3/nk/e45/e/c/a/f/1/e45ecaf1_5bea_4367_ba57_6190e348178d.png?sw=540&sh=540&sm=fit&q=80', 'https://www.nike.sa/dw/image/v2/BDVB_PRD/on/demandware.static/-/Sites-akeneo-master-catalog/default/dw20d2b5f4/nk/aee/6/e/6/a/3/aee6e6a3_248d_470b_bc93_d54db8a5ed03.png?sw=540&sh=540&sm=fit&q=80', 'https://www.nike.sa/dw/image/v2/BDVB_PRD/on/demandware.static/-/Sites-akeneo-master-catalog/default/dw85be0ba0/nk/35f/d/c/4/2/9/35fdc429_a49d_4b8f_af87_c7a74571bb7e.png?sw=540&sh=540&sm=fit&q=80', 'https://www.nike.sa/dw/image/v2/BDVB_PRD/on/demandware.static/-/Sites-akeneo-master-catalog/default/dw0f5b33bc/nk/f5a/c/f/a/4/e/f5acfa4e_62d2_42af_93b2_d6926a704e60.png?sw=540&sh=540&sm=fit&q=80', 'https://www.nike.sa/dw/image/v2/BDVB_PRD/on/demandware.static/-/Sites-akeneo-master-catalog/default/dwa1a5cc76/nk/fcd/3/e/5/f/1/fcd3e5f1_0213_4206_b7f0_a6645ee5e23c.png?sw=540&sh=540&sm=fit&q=80']","Inspired by Mike's backyard battles with his older brother Larry, the Jordan Series references their legendary sibling rivalry throughout the design. The rubber sole offers more than just impressive traction—it also tells the story of how MJ came to be #23. Look for the hidden reminder to ""Swing for the Fence"", a direct quote from Larry to his little bro.","['Circular traction inspired by the Air Jordan 1 adds durability.', 'Suede and smooth leather are combined with a sleek, low-cut silhouette for versatile styling.', 'Stretchy, triangular cut-outs add flex to accommodate wider feet.']","['Woven tongue and label', 'Embroidered graphics', 'Colour Shown: Celestial Gold/Sail', 'Style: DN1856-200']",,[]
93,Nike Dunk Low,Men's Shoes,SAR 750.00,"['https://www.nike.sa/dw/image/v2/BDVB_PRD/on/demandware.static/-/Sites-akeneo-master-catalog/default/dw5b4f1c33/nk/3e1/0/1/4/5/1/3e101451_2639_4f2f_aff4_d0c327ce2e45.png?sw=540&sh=540&sm=fit&q=80', 'https://www.nike.sa/dw/image/v2/BDVB_PRD/on/demandware.static/-/Sites-akeneo-master-catalog/default/dw60806b03/nk/cc8/4/c/a/4/7/cc84ca47_23bd_42f1_b451_107d0fdbf0ee.png?sw=540&sh=540&sm=fit&q=80', 'https://www.nike.sa/dw/image/v2/BDVB_PRD/on/demandware.static/-/Sites-akeneo-master-catalog/default/dwbb0b4809/nk/789/b/1/3/1/2/789b1312_add2_493c_ae27_fc3ce896bcf2.png?sw=540&sh=540&sm=fit&q=80', 'https://www.nike.sa/dw/image/v2/BDVB_PRD/on/demandware.static/-/Sites-akeneo-master-catalog/default/dw259ca85c/nk/2c5/d/6/6/9/1/2c5d6691_905a_4b47_b351_93e13ecb8d7e.png?sw=540&sh=540&sm=fit&q=80', 'https://www.nike.sa/dw/image/v2/BDVB_PRD/on/demandware.static/-/Sites-akeneo-master-catalog/default/dw0dcf3f22/nk/53d/4/5/d/5/a/53d45d5a_44bf_4ef8_b329_6a83f95b6da9.png?sw=540&sh=540&sm=fit&q=80']","Created for the hardwood but taken to the streets, this '80s b-ball icon returns with classic details and throwback hoops flair. Supple suede overlays help the Nike Dunk channel vintage style while boldly patterned Swoosh logos add a wild touch. Plus, the padded, low-cut collar lets you take your game anywhere in comfort.","[""Real and synthetic leather upper ages to soft perfection and features a durable construction reminiscent of '80s b-ball."", 'Foam midsole offers lightweight, responsive cushioning.', 'Low-cut, padded collar looks sleek and feels great.', 'Rubber outsole with classic hoops pivot circle adds durability, traction and heritage style.']","['Rubber outsole', 'Perforations on the toe', 'Colour Shown: Chlorophyll/Cave Stone/Light Iron Ore', 'Style: DR0156-300']","From backboards to skateboards, the influence of the Nike Dunk is undeniable. Although introduced as a basketball shoe in 1985, its flat and grippy soles were perfect for a neglected sports community—skaters. Uncovering a subculture craving creativity as much as function, the Dunk released decades of countless colourways that continue to capture the soul of skaters from coast to coast.",[]
94,Zion 2 x Naruto,Men's Basketball Shoes,SAR 850.00,"['https://www.nike.sa/dw/image/v2/BDVB_PRD/on/demandware.static/-/Sites-akeneo-master-catalog/default/dwf80b1a0f/nk/6b6/6/7/a/6/a/6b667a6a_78ab_4773_bf8b_1e0e60bc55fb.png?sw=540&sh=540&sm=fit&q=80', 'https://www.nike.sa/dw/image/v2/BDVB_PRD/on/demandware.static/-/Sites-akeneo-master-catalog/default/dwc79b6d8a/nk/0b6/5/4/9/8/1/0b654981_c9b1_4ca7_b6e2_f12bb0f4be51.png?sw=540&sh=540&sm=fit&q=80', 'https://www.nike.sa/dw/image/v2/BDVB_PRD/on/demandware.static/-/Sites-akeneo-master-catalog/default/dwac131d2a/nk/592/6/d/6/7/9/5926d679_a24d_4c03_8d97_083239b2cc17.png?sw=540&sh=540&sm=fit&q=80', 'https://www.nike.sa/dw/image/v2/BDVB_PRD/on/demandware.static/-/Sites-akeneo-master-catalog/default/dw205fa435/nk/287/a/2/7/a/d/287a27ad_9a14_410a_8428_6ad71ee0cc12.png?sw=540&sh=540&sm=fit&q=80', 'https://www.nike.sa/dw/image/v2/BDVB_PRD/on/demandware.static/-/Sites-akeneo-master-catalog/default/dw81c7b8ea/nk/fbf/d/b/2/6/7/fbfdb267_747a_48c3_82b9_64f4f4a9e2cf.png?sw=540&sh=540&sm=fit&q=80']","Zion's love for anime runs deep. So deep, he designed a special edition Zion 2 to tell the story of dark versus light, ninja versus ninja, Naruto versus Sasuke. Each shoe is split down the middle (yellow for Naruto on one side, purple for Sasuke on the other) with details throughout inspired by the characters' final battle. And as always, the Zion 2 is stacked with court-ready tech. You'll be ready for your own 1-on-1 showdown (or whatever you've got goin' on), Naruto style.","['Zion signature on the tongue and on the outsole', 'Strap over laces for a secure fit', 'Colour Shown: Black/Yellow Strike/Dark Purple Dust/Laser Blue', 'Style: FB1628-087']","[""This shoe is full of Easter eggs: details like the Laser Blue Zion logo on the outsole symbolise the energy of the Rasengan and each heel has brother-specific symbols hidden in the design. On the forefoot straps you'll find the Zion logo stylised on embossed plastic, reminiscent of Naruto's iconic headband.""]",The Zion 2 is the first shoe to feature our new larger Nike Air Strobel unit in the heel.,[]
95,Nike Quest 5,Men's Road Running Shoes,SAR 500.00,"['https://www.nike.sa/dw/image/v2/BDVB_PRD/on/demandware.static/-/Sites-akeneo-master-catalog/default/dw9292fbf4/nk/22e/9/3/8/8/5/22e93885_f78d_4cb5_abe1_f700650f11ff.png?sw=540&sh=540&sm=fit&q=80', 'https://www.nike.sa/dw/image/v2/BDVB_PRD/on/demandware.static/-/Sites-akeneo-master-catalog/default/dwe052deb0/nk/587/b/d/7/0/b/587bd70b_1d97_4ccc_b098_c6cd644aa1df.png?sw=540&sh=540&sm=fit&q=80', 'https://www.nike.sa/dw/image/v2/BDVB_PRD/on/demandware.static/-/Sites-akeneo-master-catalog/default/dw98dce080/nk/a9a/8/c/f/d/8/a9a8cfd8_d61b_4b27_a23e_6d55e0f37e1d.png?sw=540&sh=540&sm=fit&q=80', 'https://www.nike.sa/dw/image/v2/BDVB_PRD/on/demandware.static/-/Sites-akeneo-master-catalog/default/dwa5294210/nk/9d7/2/b/8/8/e/9d72b88e_8a13_4c91_b749_19cc452f18c6.png?sw=540&sh=540&sm=fit&q=80', 'https://www.nike.sa/dw/image/v2/BDVB_PRD/on/demandware.static/-/Sites-akeneo-master-catalog/default/dw22dbe98c/nk/4b0/0/0/a/4/2/4b000a42_ac7a_4baf_a896_220d6f8ccfa2.png?sw=540&sh=540&sm=fit&q=80']","You lace up in pursuit of new personal goals. Let the Nike Quest 5 help you reach those aspirations. This neutral sneaker gives you a smooth, comfortable ride with plenty of traction. We focused on our foam, adding more cushioning for a better transition from heel to toe.","['Super-soft padding and cushioning on the collar help keep your ankle comfortable.', 'Skins at the toes and eyelets offer durability.']","['Colour Shown: Black/Smoke Grey/Dark Smoke Grey/White', 'Style: DD0204-001']","Mesh throughout the upper adds a lightweight, breathable feel. The mesh was placed in key zones based on runner feedback, providing you with cooling where it counts.","['https://www.nike.sa/dw/image/v2/BDVB_PRD/on/demandware.static/-/Sites-akeneo-master-catalog/default/dw4e369ae4/nk/79e/1/3/4/c/2/79e134c2_497c_44c7_afa5_ba967bc60a5a.png?sw=520&sh=520&sm=fit', 'https://www.nike.sa/dw/image/v2/BDVB_PRD/on/demandware.static/-/Sites-akeneo-master-catalog/default/dwfc05234d/nk/654/c/7/4/3/a/654c743a_3f44_43c1_886b_49e6b5a7d49d.png?sw=520&sh=520&sm=fit', 'https://www.nike.sa/dw/image/v2/BDVB_PRD/on/demandware.static/-/Sites-akeneo-master-catalog/default/dwafa177aa/nk/469/e/4/2/a/6/469e42a6_3bd4_4e38_bc59_119d6a5b201f.png?sw=520&sh=520&sm=fit', 'https://www.nike.sa/dw/image/v2/BDVB_PRD/on/demandware.static/-/Sites-akeneo-master-catalog/default/dwc72bc532/nk/045/6/e/5/6/1/0456e561_0e69_45cc_ad19_825a257b2f4d.png?sw=520&sh=520&sm=fit']"
96,Air Jordan 1 Mid SE,Men's Shoes,SAR 629.00,"['https://www.nike.sa/dw/image/v2/BDVB_PRD/on/demandware.static/-/Sites-akeneo-master-catalog/default/dw64e4e3c7/nk/f6e/a/7/2/0/9/f6ea7209_e88f_49ca_a28d_df9c6c34b8e9.png?sw=540&sh=540&sm=fit&q=80', 'https://www.nike.sa/dw/image/v2/BDVB_PRD/on/demandware.static/-/Sites-akeneo-master-catalog/default/dwc4b1914d/nk/244/a/1/2/8/b/244a128b_4bc8_4f3c_b0ed_9da2d3302b12.png?sw=540&sh=540&sm=fit&q=80', 'https://www.nike.sa/dw/image/v2/BDVB_PRD/on/demandware.static/-/Sites-akeneo-master-catalog/default/dwa010796d/nk/f72/8/3/a/3/5/f7283a35_fa94_4ca0_b734_3d0595b91082.png?sw=540&sh=540&sm=fit&q=80', 'https://www.nike.sa/dw/image/v2/BDVB_PRD/on/demandware.static/-/Sites-akeneo-master-catalog/default/dwc2040f96/nk/019/f/a/c/5/3/019fac53_4875_4d3f_ab3b_2e765bd32936.png?sw=540&sh=540&sm=fit&q=80', 'https://www.nike.sa/dw/image/v2/BDVB_PRD/on/demandware.static/-/Sites-akeneo-master-catalog/default/dwca7c888a/nk/2f7/4/4/f/e/a/2f744fea_cb34_4477_a2b1_54aa131b2a68.png?sw=540&sh=540&sm=fit&q=80']",Get that Jordan energy on your feet this festive season. Rich grain leather with bright details make this pair shine like festive lights.,"['Nike Air technology absorbs impact for cushioning with every step.', 'Genuine and synthetic leather and textile upper for durability.']","['Wings logo on heel', 'Jumpman Air tongue label', 'Perforated toe', 'Rubber cupsole', 'Colour Shown: Black/White/Sail/Taxi', 'Style: DQ8417-071']",,[]
97,Nike Air Pegasus '89,Men's Shoes,SAR 700.00,"['https://www.nike.sa/dw/image/v2/BDVB_PRD/on/demandware.static/-/Sites-akeneo-master-catalog/default/dw53384896/nk/d59/3/f/6/5/1/d593f651_cb2f_4cd7_aaa2_3b346877944c.png?sw=540&sh=540&sm=fit&q=80', 'https://www.nike.sa/dw/image/v2/BDVB_PRD/on/demandware.static/-/Sites-akeneo-master-catalog/default/dwf4c6b4cb/nk/b98/7/1/a/2/7/b9871a27_d5e3_4e26_a117_1e389c4d3a1d.png?sw=540&sh=540&sm=fit&q=80', 'https://www.nike.sa/dw/image/v2/BDVB_PRD/on/demandware.static/-/Sites-akeneo-master-catalog/default/dwa4656f20/nk/8d6/4/5/3/b/8/8d6453b8_6694_4336_82cd_522314fa4c36.png?sw=540&sh=540&sm=fit&q=80', 'https://www.nike.sa/dw/image/v2/BDVB_PRD/on/demandware.static/-/Sites-akeneo-master-catalog/default/dw361dcb05/nk/296/d/6/f/9/6/296d6f96_0429_44fd_b995_dd6bf7830b4c.png?sw=540&sh=540&sm=fit&q=80', 'https://www.nike.sa/dw/image/v2/BDVB_PRD/on/demandware.static/-/Sites-akeneo-master-catalog/default/dw312062b9/nk/3b4/7/6/c/3/8/3b476c38_6b23_48cf_a28d_06958b16d1c7.png?sw=540&sh=540&sm=fit&q=80']","The Nike Air Pegasus '89 resurrects a look that's as fresh as the era it came from. With suede overlays, a hidden Air unit and a Waffle outsole, this street-ready edition of the Pegasus blends retro style with modern comfort.","['Suede overlays pair with a shiny knit fabric to bring you a look inspired by the original Pegasus.', 'Nike Air cushioning in the heel helps keep every step comfortable.', 'Rubber Waffle outsole provides durable traction.']","['Colour Shown: Wolf Grey/Team Red/White/Wolf Grey', 'Style: FD3598-001']",,"['https://www.nike.sa/dw/image/v2/BDVB_PRD/on/demandware.static/-/Sites-akeneo-master-catalog/default/dw9234c3b1/nk/29c/3/e/f/e/5/29c3efe5_3f22_4603_8bc4_ee91c1342ee0.png?sw=520&sh=520&sm=fit', 'https://www.nike.sa/dw/image/v2/BDVB_PRD/on/demandware.static/-/Sites-akeneo-master-catalog/default/dw86c48d48/nk/ab4/1/9/0/b/2/ab4190b2_3661_41e6_8a9e_29ca541a303e.png?sw=520&sh=520&sm=fit', 'https://www.nike.sa/dw/image/v2/BDVB_PRD/on/demandware.static/-/Sites-akeneo-master-catalog/default/dw63885aec/nk/37b/4/2/9/d/2/37b429d2_e790_444c_902e_ae7024f17ceb.png?sw=520&sh=520&sm=fit']"
98,Nike Air Max 90,Men's Shoes,SAR 449.00,"['https://www.nike.sa/dw/image/v2/BDVB_PRD/on/demandware.static/-/Sites-akeneo-master-catalog/default/dw2ebb8cf2/nk/918/7/1/d/9/1/91871d91_60e0_4716_af55_f231cd50e984.png?sw=540&sh=540&sm=fit&q=80', 'https://www.nike.sa/dw/image/v2/BDVB_PRD/on/demandware.static/-/Sites-akeneo-master-catalog/default/dwa1778d1d/nk/70d/4/3/3/d/c/70d433dc_f811_450d_a059_98281f371f54.png?sw=540&sh=540&sm=fit&q=80', 'https://www.nike.sa/dw/image/v2/BDVB_PRD/on/demandware.static/-/Sites-akeneo-master-catalog/default/dwf82f1c30/nk/86a/2/c/a/8/e/86a2ca8e_b2dc_424b_8d96_ad7ed9b5ef99.png?sw=540&sh=540&sm=fit&q=80', 'https://www.nike.sa/dw/image/v2/BDVB_PRD/on/demandware.static/-/Sites-akeneo-master-catalog/default/dwf1cfd48e/nk/c3a/8/d/a/4/c/c3a8da4c_3183_452f_8697_646a066d1918.png?sw=540&sh=540&sm=fit&q=80', 'https://www.nike.sa/dw/image/v2/BDVB_PRD/on/demandware.static/-/Sites-akeneo-master-catalog/default/dwcb3f5eaa/nk/bf0/7/3/3/f/3/bf0733f3_4ce3_43e6_a43d_3310936eb85d.png?sw=540&sh=540&sm=fit&q=80']","Lace up and feel the legacy. Produced at the intersection of art, music and culture, this champion running shoe helped define the '90s. Worn by presidents, revolutionised through collabs and celebrated via rare colourways, its striking silhouette, Waffle outsole and visible Air cushioning help keep it alive and well decades later.","['Originally designed for performance running, visible Nike Air cushioning puts the history of comfort beneath your feet.', ""Stitched overlays and plastic accents on the heel and eyestays add durability, comfort and the iconic '90s look you love."", 'Padded, low-top collar looks sleek and feels great.', 'Rubber Waffle outsole delivers traction, durability and heritage style.']","['Colour Shown: Wheatgrass/University Gold/Light Bone/Wheatgrass', 'Style: DZ4500-700']","The '90s were a turning point in culture—art, music, fashion and sneakers. The Air Max was at the forefront of the movement. With even more exposed Air cushioning and a bold new colour affectionately dubbed ""Infrared"", its revolutionised design helped the first 90 take on a life of its own. No longer just a running shoe, it solidified Air Max as a streetwear cornerstone.",[]
99,Nike Air Zoom Rival Fly 3,Men's Road Racing Shoes,SAR 449.00,"['https://www.nike.sa/dw/image/v2/BDVB_PRD/on/demandware.static/-/Sites-akeneo-master-catalog/default/dwe0a02349/nk/94c/7/5/d/9/4/94c75d94_8a99_41b9_aaf5_c054dd978d95.png?sw=540&sh=540&sm=fit&q=80', 'https://www.nike.sa/dw/image/v2/BDVB_PRD/on/demandware.static/-/Sites-akeneo-master-catalog/default/dw1ea4b17e/nk/d1e/0/b/b/9/e/d1e0bb9e_2063_41b5_890f_26c3248089cf.png?sw=540&sh=540&sm=fit&q=80', 'https://www.nike.sa/dw/image/v2/BDVB_PRD/on/demandware.static/-/Sites-akeneo-master-catalog/default/dw2caf9cec/nk/7cf/4/1/1/e/a/7cf411ea_3ad9_4644_a564_a1e10e54c412.png?sw=540&sh=540&sm=fit&q=80', 'https://www.nike.sa/dw/image/v2/BDVB_PRD/on/demandware.static/-/Sites-akeneo-master-catalog/default/dwddbc16d9/nk/87a/0/e/8/9/9/87a0e899_0238_4344_8d1a_9c0666ab175e.png?sw=540&sh=540&sm=fit&q=80', 'https://www.nike.sa/dw/image/v2/BDVB_PRD/on/demandware.static/-/Sites-akeneo-master-catalog/default/dw199dec44/nk/c66/8/5/c/6/e/c6685c6e_ee36_4211_a79a_55531e4e1c6a.png?sw=540&sh=540&sm=fit&q=80']","Are you ready to ramp up the speed and go the distance? Built for training and racing, the Nike Air Zoom Rival Fly 3 features soft foam and durable abrasion-resistant rubber to help you conquer even the rockiest of roads. Plus, Nike Zoom Air provides a snappy feel as you push towards the finishing line.","['Traditional collar provides a comfortable fit for your heel.', 'High-abrasion rubber along the sole and an overlay around the toes add durability.']","['Centre lacing', 'Reflective design details', 'Not intended for use as Personal Protective Equipment (PPE)', 'Colour Shown: Scream Green/Black/Coconut Milk/Bright Crimson', 'Style: DZ4775-304']","In anticipation of one of the biggest running races, we're celebrating the 20th anniversary of the Nike Mayfly, a popular ultra-lightweight racing shoe. Modernised graphics nod to the original Mayfly while bold race-day colours and Ekiden-inspired details celebrate the sport you love.",[]
100,Jordan Break,Slides,SAR 129.00,"['https://www.nike.sa/dw/image/v2/BDVB_PRD/on/demandware.static/-/Sites-akeneo-master-catalog/default/dw3be9f0ba/nk/bb7/0/8/6/4/8/bb708648_70de_409e_9b70_951774959346.png?sw=540&sh=540&sm=fit&q=80', 'https://www.nike.sa/dw/image/v2/BDVB_PRD/on/demandware.static/-/Sites-akeneo-master-catalog/default/dw553e3693/nk/e23/4/1/8/3/7/e2341837_6ce7_462d_88ee_cf9dbe780e0f.png?sw=540&sh=540&sm=fit&q=80', 'https://www.nike.sa/dw/image/v2/BDVB_PRD/on/demandware.static/-/Sites-akeneo-master-catalog/default/dw6bb50cf6/nk/067/b/2/5/5/0/067b2550_2d4a_4c96_9aca_34ebd73172ca.png?sw=540&sh=540&sm=fit&q=80', 'https://www.nike.sa/dw/image/v2/BDVB_PRD/on/demandware.static/-/Sites-akeneo-master-catalog/default/dw02148985/nk/1a5/5/7/f/5/0/1a557f50_1851_4cd3_9323_9e74171d8b16.png?sw=540&sh=540&sm=fit&q=80']","Featuring a fixed strap over the top of the foot, the Jordan Break Slide uses durable synthetic leather and lightweight foam cushioning for underfoot comfort.","['A fixed strap provides a secure fit.', 'A synthetic-leather upper delivers comfortable durability.', 'Phylon foam has a lightweight, soft feel underfoot.']","['Colour Shown: Black/White', 'Style: AR6374-010', 'Country/Region of Origin: VN']",,"['https://www.nike.sa/dw/image/v2/BDVB_PRD/on/demandware.static/-/Sites-akeneo-master-catalog/default/dw1e0caec1/nk/2c4/6/e/1/4/9/2c46e149_c4c4_4608_a85b_0ae0a67ab8db.png?sw=520&sh=520&sm=fit', 'https://www.nike.sa/dw/image/v2/BDVB_PRD/on/demandware.static/-/Sites-akeneo-master-catalog/default/dwcd7c4bdd/nk/d9e/a/e/0/9/e/d9eae09e_edd8_4a90_ac9c_162606e8e8b5.png?sw=520&sh=520&sm=fit']"
101,Air Jordan 1 Mid,Men's Shoes,SAR 800.00,"['https://www.nike.sa/dw/image/v2/BDVB_PRD/on/demandware.static/-/Sites-akeneo-master-catalog/default/dw4a0f62cd/nk/f75/3/4/9/c/3/f75349c3_3f82_4a93_b1e0_acad4c4f8ae2.png?sw=540&sh=540&sm=fit&q=80', 'https://www.nike.sa/dw/image/v2/BDVB_PRD/on/demandware.static/-/Sites-akeneo-master-catalog/default/dw43faca6e/nk/6eb/d/2/2/b/6/6ebd22b6_741e_4485_b7b3_a76c9dcc0b8c.png?sw=540&sh=540&sm=fit&q=80', 'https://www.nike.sa/dw/image/v2/BDVB_PRD/on/demandware.static/-/Sites-akeneo-master-catalog/default/dw33fe02b5/nk/0f9/3/9/e/2/1/0f939e21_d644_49ca_9850_d3b385a2f6d2.png?sw=540&sh=540&sm=fit&q=80', 'https://www.nike.sa/dw/image/v2/BDVB_PRD/on/demandware.static/-/Sites-akeneo-master-catalog/default/dwd0446332/nk/a6b/d/5/4/2/b/a6bd542b_cd8f_4c91_af36_f1361bb56ce7.png?sw=540&sh=540&sm=fit&q=80', 'https://www.nike.sa/dw/image/v2/BDVB_PRD/on/demandware.static/-/Sites-akeneo-master-catalog/default/dwaec236c2/nk/f5a/7/1/c/2/a/f5a71c2a_921d_4dab_9ef5_5fc8606e019d.png?sw=540&sh=540&sm=fit&q=80']","Inspired by the original AJ1, this mid-top edition maintains the iconic look you love while choice colours and crisp leather give it a distinct identity.","['Leather, synthetic leather and textile upper for a supportive feel.', 'Foam midsole and Nike Air cushioning provide lightweight comfort.', 'Rubber outsole with pivot circle gives you durable traction.']","['Colour Shown: Lucky Green/White/Black', 'Style: DQ8426-301']",,"['https://www.nike.sa/dw/image/v2/BDVB_PRD/on/demandware.static/-/Sites-akeneo-master-catalog/default/dwaff377a5/nk/fab/e/3/e/f/1/fabe3ef1_263d_42ee_b24b_09a9a47a61ee.png?sw=520&sh=520&sm=fit', 'https://www.nike.sa/dw/image/v2/BDVB_PRD/on/demandware.static/-/Sites-akeneo-master-catalog/default/dw32d3d87c/nk/4a1/c/b/d/7/6/4a1cbd76_3616_47c4_9c16_da16012a8481.png?sw=520&sh=520&sm=fit']"
102,Nike Air Max 97,Men's Shoes,SAR 599.00,"['https://www.nike.sa/dw/image/v2/BDVB_PRD/on/demandware.static/-/Sites-akeneo-master-catalog/default/dw30ee00a0/nk/eec/a/9/a/2/5/eeca9a25_4077_49c2_93c5_b7c99109864f.png?sw=540&sh=540&sm=fit&q=80', 'https://www.nike.sa/dw/image/v2/BDVB_PRD/on/demandware.static/-/Sites-akeneo-master-catalog/default/dwd16ecd09/nk/2b7/5/b/c/6/d/2b75bc6d_2cc9_41e5_81e6_6a04a1ba9791.png?sw=540&sh=540&sm=fit&q=80', 'https://www.nike.sa/dw/image/v2/BDVB_PRD/on/demandware.static/-/Sites-akeneo-master-catalog/default/dw442b021d/nk/4a7/6/d/b/a/4/4a76dba4_0d1a_41e3_9a3f_f5eceb18fb45.png?sw=540&sh=540&sm=fit&q=80', 'https://www.nike.sa/dw/image/v2/BDVB_PRD/on/demandware.static/-/Sites-akeneo-master-catalog/default/dw47179050/nk/368/b/5/9/5/e/368b595e_c5ca_4ad0_8ec0_fca81ba402e2.png?sw=540&sh=540&sm=fit&q=80', 'https://www.nike.sa/dw/image/v2/BDVB_PRD/on/demandware.static/-/Sites-akeneo-master-catalog/default/dwefa86d4b/nk/cc7/3/7/d/7/7/cc737d77_9e4f_479a_8e2f_9d85c498325d.png?sw=540&sh=540&sm=fit&q=80']","The coveted classic gets ready for wintertime. Push your style full speed ahead with its updated durable upper and super-plush liner. Reflective design details keep your style popping, while Air cushioning lets you ride in first-class comfort.","['Warm liner peeks over the collar for a cold-weather look that feels soft and cosy.', 'Nike Air technology absorbs impact for cushioning with every step.', 'Hidden lacing system creates a streamlined look.', 'Rubber outsole adds traction and durability.']","['Foam midsole', 'Not intended for use as Personal Protective Equipment (PPE)', 'Colour Shown: Black/Anthracite/Wolf Grey/University Gold', 'Style: DX0754-002']","Revolutionary Air technology first made its way into Nike footwear in 1978. The Air Max 1 debuted with visible Air technology in its heel, allowing fans more than just the feel of Air cushioning—suddenly they could see it. Since then, next-generation Air Max shoes have become a hit with athletes and collectors by offering striking colour combinations and reliable, lightweight cushioning.",[]
