,product_name,product_category,price,product_images,product_description,product_benefits,product_details,productdata_content,other_colors
297,Air Jordan 1 Low,Men's Shoes,SAR 750.00,"['https://www.nike.sa/dw/image/v2/BDVB_PRD/on/demandware.static/-/Sites-akeneo-master-catalog/default/dw82449e99/nk/573/d/5/d/7/d/573d5d7d_b855_43ac_b215_e51eb2ef98ea.png?sw=540&sh=540&sm=fit&q=80', 'https://www.nike.sa/dw/image/v2/BDVB_PRD/on/demandware.static/-/Sites-akeneo-master-catalog/default/dw3b3600d8/nk/923/c/a/7/a/8/923ca7a8_df17_49f2_99fa_ae0480962736.png?sw=540&sh=540&sm=fit&q=80', 'https://www.nike.sa/dw/image/v2/BDVB_PRD/on/demandware.static/-/Sites-akeneo-master-catalog/default/dwa21deb71/nk/930/0/c/e/3/b/9300ce3b_8ee4_4b5b_8b93_bd2d51c1bca1.png?sw=540&sh=540&sm=fit&q=80', 'https://www.nike.sa/dw/image/v2/BDVB_PRD/on/demandware.static/-/Sites-akeneo-master-catalog/default/dw57eb302f/nk/8a8/e/4/d/f/4/8a8e4df4_fb0a_4b01_89b9_5f925e2b8a95.png?sw=540&sh=540&sm=fit&q=80', 'https://www.nike.sa/dw/image/v2/BDVB_PRD/on/demandware.static/-/Sites-akeneo-master-catalog/default/dwa6b2fb31/nk/549/d/2/d/b/0/549d2db0_300b_4ea0_9418_056c205943b8.png?sw=540&sh=540&sm=fit&q=80']","Inspired by the original that debuted in 1985, the Air Jordan 1 Low offers a clean, classic look that's familiar yet always fresh. With an iconic design that pairs perfectly with any 'fit, these kicks ensure you'll always be on point.",['A timeless rubber cupsole teams up with a plush sockliner and encapsulated Nike Air cushioning for all-day comfort. A rubber outsole supplies durable traction on a variety of surfaces.'],,,[]
298,Nike Air Max Pulse,Men's Shoes,SAR 975.00,"['https://www.nike.sa/dw/image/v2/BDVB_PRD/on/demandware.static/-/Sites-akeneo-master-catalog/default/dwb35b3c15/nk/a25/b/a/0/6/5/a25ba065_1067_4025_a257_70a1f023435a.png?sw=540&sh=540&sm=fit&q=80', 'https://www.nike.sa/dw/image/v2/BDVB_PRD/on/demandware.static/-/Sites-akeneo-master-catalog/default/dw08e8eab5/nk/d02/7/2/5/c/8/d02725c8_5f5b_4dd6_9d35_bd3375c9bf99.png?sw=540&sh=540&sm=fit&q=80', 'https://www.nike.sa/dw/image/v2/BDVB_PRD/on/demandware.static/-/Sites-akeneo-master-catalog/default/dwa6d3775a/nk/087/9/4/0/3/0/08794030_a689_4e20_8b79_a3c52eda9a23.png?sw=540&sh=540&sm=fit&q=80', 'https://www.nike.sa/dw/image/v2/BDVB_PRD/on/demandware.static/-/Sites-akeneo-master-catalog/default/dw348143bd/nk/954/b/8/d/d/f/954b8ddf_3555_4119_8434_2017d45aacb5.png?sw=540&sh=540&sm=fit&q=80', 'https://www.nike.sa/dw/image/v2/BDVB_PRD/on/demandware.static/-/Sites-akeneo-master-catalog/default/dwc67003a9/nk/07e/8/3/7/d/2/07e837d2_6075_49ed_853e_0b28375732ca.png?sw=540&sh=540&sm=fit&q=80']","The Air Max Pulse pulls inspiration from the London music scene, bringing an underground touch to the iconic Air Max line. Its textile-wrapped midsole and vacuum-sealed accents keep 'em looking fresh and clean, while colours inspired by the London music scene give your look the edge. Point-loaded Air cushioning—revamped from the incredibly plush Air Max 270—delivers better bounce, helping you push past your limits.","['Textile on the upper', 'Leather and synthetic overlays', 'Foam midsole', 'Rubber Waffle outsole', 'Not intended for use as Personal Protective Equipment (PPE)', 'Colour Shown: Cobblestone/Light Orewood Brown/Black/Reflect Silver', 'Style: DR0453-004']","['A new point-loaded cushioning system features a plastic clip that distributes weight to targeted points across the Air unit, delivering a unique experience full of bounce.']","Performance comfort re-engineered for the streets, the sporty design is eye-catching and versatile. Throw them on with your best outfit and go to the max.",[]
299,Nike Zoom Mercurial Vapor 15 Academy CR7 TF,Turf Football Shoes,SAR 309.00,"['https://www.nike.sa/dw/image/v2/BDVB_PRD/on/demandware.static/-/Sites-akeneo-master-catalog/default/dw074e9e58/nk/de9/d/0/1/4/2/de9d0142_855f_4205_a915_7a8242e49711.png?sw=540&sh=540&sm=fit&q=80', 'https://www.nike.sa/dw/image/v2/BDVB_PRD/on/demandware.static/-/Sites-akeneo-master-catalog/default/dwd3e373c6/nk/316/a/d/f/e/a/316adfea_03b1_4f39_83fd_be33f473ad33.png?sw=540&sh=540&sm=fit&q=80', 'https://www.nike.sa/dw/image/v2/BDVB_PRD/on/demandware.static/-/Sites-akeneo-master-catalog/default/dwe96ce4f6/nk/cb7/1/7/8/7/2/cb717872_9c6b_44a2_98b5_cc252150b5ae.png?sw=540&sh=540&sm=fit&q=80', 'https://www.nike.sa/dw/image/v2/BDVB_PRD/on/demandware.static/-/Sites-akeneo-master-catalog/default/dw0900e83f/nk/3df/6/d/b/7/6/3df6db76_3d6d_4b18_a793_9f186c581de3.png?sw=540&sh=540&sm=fit&q=80', 'https://www.nike.sa/dw/image/v2/BDVB_PRD/on/demandware.static/-/Sites-akeneo-master-catalog/default/dw45e206e7/nk/78d/f/6/0/8/b/78df608b_8426_4b3c_8d5d_98caf50c0f39.png?sw=540&sh=540&sm=fit&q=80']","Like Cristiano Ronaldo, azulejo tiles are a Portuguese national treasure. For the Nike Zoom Mercurial Vapor 15 Academy CR7, we took visual inspiration from the Portuguese icons to show what can be achieved when one dedicates themselves to the craft. Now loaded with a football-specific Zoom Air unit, you can put the pedal down in the waning minutes of a match—when it matters most.","['For use on shorter, synthetic surfaces', 'Cushioned insole', 'Colour Shown: White/Concord/Medium Blue/Metallic Copper', 'Style: DQ5319-182']","[""The all-over, one-of-a-kind graphic on the upper pays tribute to some of CR7's past boots in an azulejo pattern.""]","For the 1st time in our history, Nike has developed an all-new Zoom Air unit. It sits in the outsole and provides an additional level of springy underfoot feel that helps you move faster on the pitch and create separation when it matters most—whether you're scoring goals, being first to the ball or going by defenders.",[]
300,Nike Air More Uptempo '96,Men's Shoes,"SAR 1,150.00","['https://www.nike.sa/dw/image/v2/BDVB_PRD/on/demandware.static/-/Sites-akeneo-master-catalog/default/dwae53c712/nk/f4b/5/6/c/0/b/f4b56c0b_1a73_413d_9a66_52a3c8a76abc.png?sw=540&sh=540&sm=fit&q=80', 'https://www.nike.sa/dw/image/v2/BDVB_PRD/on/demandware.static/-/Sites-akeneo-master-catalog/default/dwe4944bb1/nk/c45/0/3/8/0/b/c450380b_ccec_407b_8c7f_447715f3aa49.png?sw=540&sh=540&sm=fit&q=80', 'https://www.nike.sa/dw/image/v2/BDVB_PRD/on/demandware.static/-/Sites-akeneo-master-catalog/default/dwf13fa988/nk/363/5/b/6/6/5/3635b665_93ed_4de6_97d5_c0b10fc429fb.png?sw=540&sh=540&sm=fit&q=80', 'https://www.nike.sa/dw/image/v2/BDVB_PRD/on/demandware.static/-/Sites-akeneo-master-catalog/default/dw064043df/nk/5c6/7/b/8/4/1/5c67b841_f298_4e9c_94fa_f7ab2c1ecdc9.png?sw=540&sh=540&sm=fit&q=80', 'https://www.nike.sa/dw/image/v2/BDVB_PRD/on/demandware.static/-/Sites-akeneo-master-catalog/default/dw3884f0e9/nk/5b2/a/7/f/c/7/5b2a7fc7_0ad1_4b0e_8a6a_1d724882fd88.png?sw=540&sh=540&sm=fit&q=80']","Bold, eye-catching and all about the AIR. The Nike Air More Uptempo '96 refreshes an original that has reigned supreme for more than 20 years. With a design inspired by high-flying basketball style and '90s graffiti art, these kicks can't help but turn heads off court. Plus, the Max Air units in the heel, forefoot and midfoot provide comfortable cushioning so you feel as good as you look.","[""Oversized '90s graffiti-inspired branding celebrates the streets you walk and the Air you walk on."", 'Originally designed for performance hoops, Max Air units add lightweight, durable cushioning.', 'The upper features a mix of real and synthetic leather while mesh details on the tongue help keep it lightweight and breathable.', 'Elastic straps across the top of the foot help keep your fit secure, letting you wear these laced or unlaced.', 'Round laces match the round pull tabs on the heel and tongue for added style points.']","['Embroidered Swoosh logos', 'Foam in the midsole', 'Colour Shown: White/Pure Platinum/Racer Blue', 'Style: FD0669-100']",,[]
301,Nike Blazer Low '77 Premium,Men's Shoes,SAR 299.00,"['https://www.nike.sa/dw/image/v2/BDVB_PRD/on/demandware.static/-/Sites-akeneo-master-catalog/default/dwca188170/nk/ddf/5/5/5/1/8/ddf55518_328c_47e1_9ac4_de3c6a5c716d.png?sw=540&sh=540&sm=fit&q=80', 'https://www.nike.sa/dw/image/v2/BDVB_PRD/on/demandware.static/-/Sites-akeneo-master-catalog/default/dw531b7e4e/nk/88f/8/f/d/8/c/88f8fd8c_8af9_4925_9787_efa4bf13281e.png?sw=540&sh=540&sm=fit&q=80', 'https://www.nike.sa/dw/image/v2/BDVB_PRD/on/demandware.static/-/Sites-akeneo-master-catalog/default/dw27c9b038/nk/2ab/4/f/f/a/3/2ab4ffa3_f736_46ec_a23d_2157ff3d7360.png?sw=540&sh=540&sm=fit&q=80', 'https://www.nike.sa/dw/image/v2/BDVB_PRD/on/demandware.static/-/Sites-akeneo-master-catalog/default/dw1d765467/nk/a6b/e/d/0/7/5/a6bed075_2c82_4da8_a517_50b8fc102e97.png?sw=540&sh=540&sm=fit&q=80', 'https://www.nike.sa/dw/image/v2/BDVB_PRD/on/demandware.static/-/Sites-akeneo-master-catalog/default/dwf9ac6cc1/nk/8fc/7/2/d/7/0/8fc72d70_068b_4457_b2af_61ad96f2353e.png?sw=540&sh=540&sm=fit&q=80']","Bring the spook factor to the scariest night of the year. With shadowy branding and ghoulish green accents, your wardrobe staple goes all out this Halloween. With its plush collar and durable design, you'll never want to take them off—don't say we didn't warn you.","['Shadow effect on the Swoosh and the back of the heel keeps the Halloween spirit in every step.', 'Reflective design details on the upper let the trick-or-treater within you shine.', 'Rubber outsole in a ghoulish green adds traction and durability while pairing perfectly with your costume.', 'Originally designed for performance hoops, the durable construction, tough stitching and easy-entry lacing delivers comfort that lasts.', 'Padded, low-cut collar looks sleek and feels great.', 'Vulcanised construction fuses the sole to the upper for a flexible, broken-in feel.']","['Colour Shown: Phantom/Ghost Green/Scream Green/Phantom', 'Style: DQ7671-001']","Originally introduced in 1972 as a basketball shoe, the Blazer has since transformed into a modern staple for skaters and sneakerheads alike. Maturing from a simple canvas high top to a leather mid top and casual low top, this shoe just gets better with age.",[]
302,Air Jordan 1 Zoom CMFT 2,Men's Shoes,SAR 729.00,"['https://www.nike.sa/dw/image/v2/BDVB_PRD/on/demandware.static/-/Sites-akeneo-master-catalog/default/dw30f575b2/nk/794/9/2/3/0/9/79492309_546d_496b_aeb5_58e4758cf89f.png?sw=540&sh=540&sm=fit&q=80', 'https://www.nike.sa/dw/image/v2/BDVB_PRD/on/demandware.static/-/Sites-akeneo-master-catalog/default/dw14486054/nk/cbf/e/4/0/c/d/cbfe40cd_5730_4ffe_a524_d9202e75a862.png?sw=540&sh=540&sm=fit&q=80', 'https://www.nike.sa/dw/image/v2/BDVB_PRD/on/demandware.static/-/Sites-akeneo-master-catalog/default/dwd71c18db/nk/082/7/a/c/b/3/0827acb3_e608_4446_86b4_f9bd96ff44a5.png?sw=540&sh=540&sm=fit&q=80', 'https://www.nike.sa/dw/image/v2/BDVB_PRD/on/demandware.static/-/Sites-akeneo-master-catalog/default/dw1aa2cf80/nk/2ab/4/0/6/c/1/2ab406c1_bc9a_492a_8582_0be024df8208.png?sw=540&sh=540&sm=fit&q=80', 'https://www.nike.sa/dw/image/v2/BDVB_PRD/on/demandware.static/-/Sites-akeneo-master-catalog/default/dwd04316e2/nk/d1d/1/1/0/e/7/d1d110e7_3950_48c1_be50_cdae42b6904e.png?sw=540&sh=540&sm=fit&q=80']","Premium suede and Jordan Brand's signature Formula 23 foam come together to give you an extra luxurious (and extra cosy) AJ1. You don't need to play ""either or"" when it comes to choosing style or comfort with this one—which is nice, 'cause you deserve both.","['Nike Air technology absorbs impact for cushioning with every step.', 'Suede on the upper and toe breaks in easily and contours to your feet.', 'Jordan Formula 23 foam keeps your feet extra padded.']","['Colour Shown: Black/Cement Grey/White/Fire Red', 'Style: DV1307-060']",,"['https://www.nike.sa/dw/image/v2/BDVB_PRD/on/demandware.static/-/Sites-akeneo-master-catalog/default/dw1a366126/nk/970/2/9/b/b/e/97029bbe_ccc1_4ad0_b51e_eff86332418d.png?sw=520&sh=520&sm=fit', 'https://www.nike.sa/dw/image/v2/BDVB_PRD/on/demandware.static/-/Sites-akeneo-master-catalog/default/dw83041f02/nk/2e3/1/7/d/2/d/2e317d2d_d164_46a8_b0dc_ea3e5a43e490.png?sw=520&sh=520&sm=fit']"
303,Nike Zoom Mercurial Vapor 15 Elite FG,Firm-Ground Football Boots,SAR 799.00,"['https://www.nike.sa/dw/image/v2/BDVB_PRD/on/demandware.static/-/Sites-akeneo-master-catalog/default/dw80022433/nk/152/9/c/f/1/c/1529cf1c_368e_4e63_b756_ed3d07710111.png?sw=540&sh=540&sm=fit&q=80', 'https://www.nike.sa/dw/image/v2/BDVB_PRD/on/demandware.static/-/Sites-akeneo-master-catalog/default/dw54453d35/nk/c86/7/3/a/9/a/c8673a9a_02e2_4518_91e4_6fa5c52d5566.png?sw=540&sh=540&sm=fit&q=80', 'https://www.nike.sa/dw/image/v2/BDVB_PRD/on/demandware.static/-/Sites-akeneo-master-catalog/default/dw7f9e94ff/nk/3c9/e/8/c/6/f/3c9e8c6f_1b37_49f9_b9c8_9e247dd9edfe.png?sw=540&sh=540&sm=fit&q=80', 'https://www.nike.sa/dw/image/v2/BDVB_PRD/on/demandware.static/-/Sites-akeneo-master-catalog/default/dw51b247b4/nk/1be/0/3/8/9/c/1be0389c_2d06_491c_941e_0726b4d35ec9.png?sw=540&sh=540&sm=fit&q=80', 'https://www.nike.sa/dw/image/v2/BDVB_PRD/on/demandware.static/-/Sites-akeneo-master-catalog/default/dw70ee5e6b/nk/320/e/2/5/a/3/320e25a3_1e8a_430e_8ebd_af570c6c4f70.png?sw=540&sh=540&sm=fit&q=80']","Celebrate the game's biggest competition in a design ignited by the science of connectivity and gravity that the world stage inspires. A carbon-fibre chrome plate complements a stunning futuristic look made for the feet of the globe's greatest players. Loaded with a Zoom Air unit and grippy texture up top for exceptional touch, it helps you dominate in the waning minutes of a match—when it matters most.","['The chrome finish on the sole of this product will wear off with use over time. This is part of the normal wear and tear of this product.', 'For use on slightly wet, short-grass pitches', 'Cushioned insole', 'Colour Shown: Metallic Copper/Metallic Copper', 'Style: DR5934-810']","[""Keep an eye out for special symbols around the design, nods to the host's whereabouts that pay homage to the game's grandest worldwide tournament. Nike's WHQ coordinates and emblems that speak to the science of connected energy are near the heel.""]","For the 1st time in our history, Nike has developed an all-new, football-specific 3/4 Zoom Air unit. It sits in the plate and provides a more springy underfoot feel that helps you move faster on the pitch and create separation when it matters the most—whether you're scoring goals, being first to the ball or going past defenders.",[]
304,Nike Dunk High Retro Premium,Men's Shoes,SAR 800.00,"['https://www.nike.sa/dw/image/v2/BDVB_PRD/on/demandware.static/-/Sites-akeneo-master-catalog/default/dwb4469bbc/nk/a75/3/e/4/7/4/a753e474_2504_4a13_883f_1eb04ee848d7.png?sw=540&sh=540&sm=fit&q=80', 'https://www.nike.sa/dw/image/v2/BDVB_PRD/on/demandware.static/-/Sites-akeneo-master-catalog/default/dwd3944bd2/nk/7e2/8/a/6/1/0/7e28a610_0089_497c_a9af_f9dc3194bbe0.png?sw=540&sh=540&sm=fit&q=80', 'https://www.nike.sa/dw/image/v2/BDVB_PRD/on/demandware.static/-/Sites-akeneo-master-catalog/default/dw2df239f7/nk/d15/e/a/5/1/a/d15ea51a_503e_4225_ada0_320c43143a86.png?sw=540&sh=540&sm=fit&q=80', 'https://www.nike.sa/dw/image/v2/BDVB_PRD/on/demandware.static/-/Sites-akeneo-master-catalog/default/dwc546711c/nk/814/a/c/b/2/b/814acb2b_143f_47db_a37f_5ebca3487c9a.png?sw=540&sh=540&sm=fit&q=80', 'https://www.nike.sa/dw/image/v2/BDVB_PRD/on/demandware.static/-/Sites-akeneo-master-catalog/default/dw1421c4af/nk/35f/e/1/0/c/6/35fe10c6_53f5_4e99_b6c5_b17fbdeff1dc.png?sw=540&sh=540&sm=fit&q=80']"," Quench your thirst for style with this salty take on the hoops original. Preserving everything you know best—era-echoing construction, ultra-padded design and nothin'but-net style—its cracked leather, salt-washed colours and weathered accents maintain its status as the coveted off-court shoe.","[""Cracked leather Swoosh and weathered, salt-bleached colours nod to this years NBA All-Star game's host city, Salt Lake City."", 'Washed canvas brings you a summery aesthetic, while the unique salt-washed midsole treatment delivers a 1-of-a-kind, artisan finish.', 'Foam midsole offers lightweight, responsive cushioning.', 'Rubber outsole with classic hoops pivot circle adds durable traction and heritage style.']","['Colour Shown: Summit White/Phantom/Pink Oxford/White', 'Style: DV0822-100']","From backboards to skateboards, the influence of the Nike Dunk is undeniable. Although introduced as a basketball shoe in 1985, its flat and grippy soles were perfect for a neglected sports community—skaters. Uncovering a subculture craving creativity as much as function, the Dunk released decades of countless colourways that continue to capture the soul of skaters from coast to coast.",[]
305,Nike Zoom Mercurial Dream Speed Superfly 9 Academy MG,Multi-Ground Football Boot,SAR 600.00,"['https://www.nike.sa/dw/image/v2/BDVB_PRD/on/demandware.static/-/Sites-akeneo-master-catalog/default/dw040984f4/nk/0a2/b/f/6/7/b/0a2bf67b_c223_4e1f_a88a_9d1cab6a07c0.png?sw=540&sh=540&sm=fit&q=80', 'https://www.nike.sa/dw/image/v2/BDVB_PRD/on/demandware.static/-/Sites-akeneo-master-catalog/default/dw5767cd65/nk/e7d/8/6/4/2/8/e7d86428_65c7_436d_84e7_74f335226479.png?sw=540&sh=540&sm=fit&q=80', 'https://www.nike.sa/dw/image/v2/BDVB_PRD/on/demandware.static/-/Sites-akeneo-master-catalog/default/dwb436da8d/nk/40a/4/d/7/3/5/40a4d735_a873_489c_a2ce_bbe87b7ab0d5.png?sw=540&sh=540&sm=fit&q=80', 'https://www.nike.sa/dw/image/v2/BDVB_PRD/on/demandware.static/-/Sites-akeneo-master-catalog/default/dw8474ad41/nk/222/d/f/d/2/c/222dfd2c_01e6_436c_b1dd_7298947b01bd.png?sw=540&sh=540&sm=fit&q=80', 'https://www.nike.sa/dw/image/v2/BDVB_PRD/on/demandware.static/-/Sites-akeneo-master-catalog/default/dw515b5c72/nk/253/d/4/e/4/7/253d4e47_ea36_4d21_bc5a_865b14e87e8d.png?sw=540&sh=540&sm=fit&q=80']","Cristiano Ronaldo couldn't chase his dream alone. Coaches, family members and role models have all helped mould him into the star he is today. Celebrate the people who have motivated you along the way. Floral-like lavender and electrifying yellows remind you to let inspirations know they're loved and appreciated. Now loaded with a football-specific Zoom Air unit, you can put the pedal down in the waning minutes of a match—when it matters most.","['For use on natural and synthetic surfaces', 'Cushioned insole', 'Colour Shown: Cobalt Bliss/Fuchsia Dream/Hot Punch/Black', 'Style: DV2421-405']","[""Flowers are a symbol of where it all started, and the journey taken since. They're a way to honour those who have influenced and helped you, to recognise those who share your competitive fire. Layered digital tones with metallic and colour shifting add depth to a distorted flower graphic.""]","The heel Zoom Air unit sits in the plate and provides an extra level of springy underfoot feel that helps you move faster on the pitch. It creates separation when it matters the most—whether you're scoring goals, being first to the ball or going by defenders.",[]
306,Nike Dunk Low Retro,Men's Shoes,SAR 429.00,"['https://www.nike.sa/dw/image/v2/BDVB_PRD/on/demandware.static/-/Sites-akeneo-master-catalog/default/dw3ed1f46f/nk/159/5/9/9/8/c/1595998c_d6eb_4187_a6e4_d3345046bc98.png?sw=540&sh=540&sm=fit&q=80', 'https://www.nike.sa/dw/image/v2/BDVB_PRD/on/demandware.static/-/Sites-akeneo-master-catalog/default/dw06a89868/nk/6dc/2/8/e/2/6/6dc28e26_775a_4ba0_a0ab_667ed0ccd821.png?sw=540&sh=540&sm=fit&q=80', 'https://www.nike.sa/dw/image/v2/BDVB_PRD/on/demandware.static/-/Sites-akeneo-master-catalog/default/dw78670f96/nk/7c3/e/c/6/8/2/7c3ec682_f9fc_41b7_8205_7aab78ffeb84.png?sw=540&sh=540&sm=fit&q=80', 'https://www.nike.sa/dw/image/v2/BDVB_PRD/on/demandware.static/-/Sites-akeneo-master-catalog/default/dw6a879e10/nk/70c/8/6/a/4/a/70c86a4a_8c21_49e6_b254_38bf57c1bfc2.png?sw=540&sh=540&sm=fit&q=80', 'https://www.nike.sa/dw/image/v2/BDVB_PRD/on/demandware.static/-/Sites-akeneo-master-catalog/default/dw6bd259f2/nk/124/3/9/7/0/a/1243970a_15c7_4c41_971d_b32b0e91abfb.png?sw=540&sh=540&sm=fit&q=80']","Recognising the Dunk's roots as the top-ranking university-team sneaker, the Be True To Your School Pack looks to the original ad campaign for inspiration. Colours represent top-flight universities, while crisp leather has the perfect amount of sheen to make 'em a hands-down win. So lace up and show off that varsity spirit. Are you game?","['Colours let you rep your favourite university teams.', 'Leather upper ages to soft perfection.', 'Foam midsole offers lightweight, responsive cushioning.', 'Padded, low-cut collar looks sleek and feels great.', 'Rubber outsole with classic hoops pivot circle adds durable traction and heritage style.']","['Colour Shown: Apple Green/White/Yellow Strike/Yellow Strike', 'Style: DV0833-300']"," From backboards to skateboards, the influence of the Nike Dunk is undeniable. Although introduced as a basketball shoe in 1985, its flat and grippy soles were perfect for a neglected sports community—skaters. Uncovering a subculture craving creativity as much as function, the Dunk released decades of countless colourways that continue to capture the soul of skaters from coast to coast.",[]
307,Nike Zoom Mercurial Dream Speed Superfly 9 Elite FG,Firm-Ground Football Boot,"SAR 1,800.00","['https://www.nike.sa/dw/image/v2/BDVB_PRD/on/demandware.static/-/Sites-akeneo-master-catalog/default/dw9041741e/nk/fbd/e/f/6/c/6/fbdef6c6_3d91_4522_abb5_e68154e4fab8.png?sw=540&sh=540&sm=fit&q=80', 'https://www.nike.sa/dw/image/v2/BDVB_PRD/on/demandware.static/-/Sites-akeneo-master-catalog/default/dwf7e7826f/nk/acf/1/0/1/2/a/acf1012a_ae8d_4443_b7b9_4f2bbf2f822b.png?sw=540&sh=540&sm=fit&q=80', 'https://www.nike.sa/dw/image/v2/BDVB_PRD/on/demandware.static/-/Sites-akeneo-master-catalog/default/dw2592dae7/nk/e72/d/c/3/1/b/e72dc31b_d658_4d59_8e1c_e6806559609e.png?sw=540&sh=540&sm=fit&q=80', 'https://www.nike.sa/dw/image/v2/BDVB_PRD/on/demandware.static/-/Sites-akeneo-master-catalog/default/dw1f189ab5/nk/8da/e/d/7/2/5/8daed725_b8df_403c_99b7_a50ed9130b19.png?sw=540&sh=540&sm=fit&q=80', 'https://www.nike.sa/dw/image/v2/BDVB_PRD/on/demandware.static/-/Sites-akeneo-master-catalog/default/dw1266c28f/nk/d14/9/7/2/9/4/d1497294_d56f_4cfe_9648_88656d4c1d59.png?sw=540&sh=540&sm=fit&q=80']","Cristiano Ronaldo couldn't chase his dream alone. Coaches, family members, role models have all helped mould him into the star he is today. Celebrate the people who have motivated you along the way. Floral-like lavender and electrifying yellows remind you to let inspirations know they're loved and appreciated. We added a Zoom Air unit and grippy texture up top for exceptional touch, so you can dominate in the waning minutes of a match—when it matters most.","['For use on slightly wet, short-grass pitches', 'Cushioned insole', 'Colour Shown: Cobalt Bliss/Fuchsia Dream/Hot Punch/Black', 'Style: DV2413-405']","[""Flowers are a symbol of where it all started, and the journey taken since. They're a way to honour those who have influenced and helped you, to recognise those who share your competitive fire. Layered digital tones with metallic and colour-shifting add depth to a distorted flower graphic.""]","The 3/4-length Zoom Air unit sits in the plate and provides another level of springy underfoot feel that helps you move faster on the pitch. It creates separation when it matters the most—whether you're scoring goals, being first to the ball or going by defenders.",[]
308,Nike Air Max 90 G NRG,Golf Shoes,SAR 749.00,"['https://www.nike.sa/dw/image/v2/BDVB_PRD/on/demandware.static/-/Sites-akeneo-master-catalog/default/dw29f2d0e8/nk/381/9/e/d/1/2/3819ed12_6879_4622_b88d_fe88b0d18115.png?sw=540&sh=540&sm=fit&q=80', 'https://www.nike.sa/dw/image/v2/BDVB_PRD/on/demandware.static/-/Sites-akeneo-master-catalog/default/dwdddf514d/nk/edb/a/1/7/b/e/edba17be_45a9_44b9_bb5e_147529bdc4b1.png?sw=540&sh=540&sm=fit&q=80', 'https://www.nike.sa/dw/image/v2/BDVB_PRD/on/demandware.static/-/Sites-akeneo-master-catalog/default/dw3dc3ccde/nk/278/f/1/2/1/6/278f1216_e1ff_4bc4_9153_604f9f9c3c63.png?sw=540&sh=540&sm=fit&q=80', 'https://www.nike.sa/dw/image/v2/BDVB_PRD/on/demandware.static/-/Sites-akeneo-master-catalog/default/dwcb5e4985/nk/8c0/9/e/6/e/5/8c09e6e5_42dd_41d8_a872_9441877cbae9.png?sw=540&sh=540&sm=fit&q=80', 'https://www.nike.sa/dw/image/v2/BDVB_PRD/on/demandware.static/-/Sites-akeneo-master-catalog/default/dw8280a393/nk/33f/4/4/4/6/1/33f44461_1892_48d9_a715_25036fcf24d6.png?sw=540&sh=540&sm=fit&q=80']","Step into the 1st tee box with the timeless flair and functionality of the Nike Air Max 90 G NRG. It blends the original AM90's essence with a few updates specifically designed for the links, like traction pattern and a thin overlay that helps keep out water.",['The traction pattern gives you optimal grip in various conditions. The design draws its inspiration from the iconic Waffle outsole on the original Air Max 90.'],"['Fused overlays, extra eyestays and strategically placed mesh capture the look of the original Air Max 90. The mesh has a thin, flexible overlay that helps keep out water and makes it easy to clean your shoes.']",A foam midsole with Max Air unit in the heel cushions every step.,[]
