,product_name,product_category,price,product_images,product_description,product_benefits,product_details,productdata_content,other_colors
196,Nike Pegasus 39,Men's Road Running Shoes,SAR 479.00,"['https://www.nike.sa/dw/image/v2/BDVB_PRD/on/demandware.static/-/Sites-akeneo-master-catalog/default/dw2c6ec54b/nk/79e/e/a/f/7/5/79eeaf75_8907_4bdb_8c77_c05599d9c4a1.png?sw=540&sh=540&sm=fit&q=80', 'https://www.nike.sa/dw/image/v2/BDVB_PRD/on/demandware.static/-/Sites-akeneo-master-catalog/default/dw758e96f6/nk/f91/b/0/2/8/f/f91b028f_4358_42b3_8b52_85371ca53abd.png?sw=540&sh=540&sm=fit&q=80', 'https://www.nike.sa/dw/image/v2/BDVB_PRD/on/demandware.static/-/Sites-akeneo-master-catalog/default/dwf44c040d/nk/a2c/8/8/d/4/7/a2c88d47_2673_4cb5_96a4_8adb1d78d4e5.png?sw=540&sh=540&sm=fit&q=80', 'https://www.nike.sa/dw/image/v2/BDVB_PRD/on/demandware.static/-/Sites-akeneo-master-catalog/default/dwcc3c70d3/nk/1bc/e/a/0/6/5/1bcea065_987a_4195_8c85_d4d7f8431582.png?sw=540&sh=540&sm=fit&q=80', 'https://www.nike.sa/dw/image/v2/BDVB_PRD/on/demandware.static/-/Sites-akeneo-master-catalog/default/dwff41eb2a/nk/425/3/e/5/d/e/4253e5de_71d8_4e1f_9ce6_9e47ff8b8284.png?sw=540&sh=540&sm=fit&q=80']","Let the Nike Pegasus 39 help you ascend to new heights. More lightweight up top than the Pegasus 38 and ideal to wear in any season, it has a supportive sensation to help keep your feet contained, while underfoot cushioning and double Zoom Air units (1 more than the Peg 38) give you an extra pop to your step. Your trusted workhorse with wings is back. Time to fly.","['The tongue, separated from the upper, gives room for different foot shapes.', 'Waffle-inspired outsole gives you excellent traction.', 'Grooves on the rubber sole let you move freely.']","['Colour Shown: Black/Dark Smoke Grey/White', 'Style: DH4071-001']","Extra padding at the tongue and collar helps keep your feet feeling comfortable. Engineered mesh, which is stronger and more flexible than normal mesh, throughout the top provides lightweight breathability.","['https://www.nike.sa/dw/image/v2/BDVB_PRD/on/demandware.static/-/Sites-akeneo-master-catalog/default/dw33da4f2e/nk/7a5/6/3/c/5/a/7a563c5a_6048_4804_97a4_1cc4de6f6097.png?sw=520&sh=520&sm=fit', 'https://www.nike.sa/dw/image/v2/BDVB_PRD/on/demandware.static/-/Sites-akeneo-master-catalog/default/dw6ad16154/nk/0d6/e/3/a/5/9/0d6e3a59_b734_4701_862d_f1d881c7ecd5.png?sw=520&sh=520&sm=fit', 'https://www.nike.sa/dw/image/v2/BDVB_PRD/on/demandware.static/-/Sites-akeneo-master-catalog/default/dw3bed9df0/nk/aed/f/5/b/a/2/aedf5ba2_51c9_4635_86a3_a70c9f7058f0.png?sw=520&sh=520&sm=fit', 'https://www.nike.sa/dw/image/v2/BDVB_PRD/on/demandware.static/-/Sites-akeneo-master-catalog/default/dw5492c8e8/nk/caa/6/d/4/a/e/caa6d4ae_c60e_4c73_98d4_d8f3427e0213.png?sw=520&sh=520&sm=fit']"
197,Nike Dunk Low,Men's Shoes,SAR 750.00,"['https://www.nike.sa/dw/image/v2/BDVB_PRD/on/demandware.static/-/Sites-akeneo-master-catalog/default/dwb0c963f0/nk/469/f/6/f/7/2/469f6f72_10c4_4012_9af0_d3742cf06c78.png?sw=540&sh=540&sm=fit&q=80', 'https://www.nike.sa/dw/image/v2/BDVB_PRD/on/demandware.static/-/Sites-akeneo-master-catalog/default/dw9da8696d/nk/e18/5/8/e/b/4/e1858eb4_f2a5_47c7_8e51_11aa9ce1d5da.png?sw=540&sh=540&sm=fit&q=80', 'https://www.nike.sa/dw/image/v2/BDVB_PRD/on/demandware.static/-/Sites-akeneo-master-catalog/default/dw821aad96/nk/41e/d/1/e/e/f/41ed1eef_ff91_4d42_9d9d_06f25418168c.png?sw=540&sh=540&sm=fit&q=80', 'https://www.nike.sa/dw/image/v2/BDVB_PRD/on/demandware.static/-/Sites-akeneo-master-catalog/default/dwd1ce765c/nk/529/f/3/4/1/e/529f341e_d61f_460f_996a_fa6ddf389cba.png?sw=540&sh=540&sm=fit&q=80', 'https://www.nike.sa/dw/image/v2/BDVB_PRD/on/demandware.static/-/Sites-akeneo-master-catalog/default/dwaaa855c8/nk/2ca/0/f/0/8/2/2ca0f082_da90_4ac5_bd2e_bd5003a0cad5.png?sw=540&sh=540&sm=fit&q=80']","Created for the hardwood but taken to the streets, this '80s b-ball icon returns with classic details and throwback hoops flair. The supple leather overlays help the Nike Dunk channel vintage style while its padded, low-cut collar lets you take your game anywhere—in comfort.","[""The leather on the upper ages to soft perfection and features durable construction reminiscent of '80s b-ball."", 'Foam midsole offers lightweight, responsive cushioning.', 'Low-cut, padded collar looks sleek and feels great.', 'Rubber outsole with classic hoops pivot circle adds durability, traction and heritage style.']","['Colour Shown: Stadium Green/White/Black', 'Style: FN3612-300']","From backboards to skateboards, the influence of the Nike Dunk is undeniable. Although introduced as a basketball shoe in 1985, its flat and grippy soles were perfect for a neglected sport community—skaters. Uncovering a subculture craving creativity as much as function, the Dunk released decades of countless colourways that continue to capture the soul of skaters from coast to coast.",[]
198,Jordan 6 Rings,Men's Shoes,"SAR 1,100.00","['https://www.nike.sa/dw/image/v2/BDVB_PRD/on/demandware.static/-/Sites-akeneo-master-catalog/default/dw1583e5eb/nk/e8b/e/4/d/b/5/e8be4db5_1f18_4371_85cc_562caf760dcb.png?sw=540&sh=540&sm=fit&q=80', 'https://www.nike.sa/dw/image/v2/BDVB_PRD/on/demandware.static/-/Sites-akeneo-master-catalog/default/dw82058c3e/nk/b22/6/d/8/9/b/b226d89b_0850_4f13_b5f6_e0f38060713f.png?sw=540&sh=540&sm=fit&q=80', 'https://www.nike.sa/dw/image/v2/BDVB_PRD/on/demandware.static/-/Sites-akeneo-master-catalog/default/dw578193b3/nk/a45/3/d/1/a/c/a453d1ac_e237_41c8_abc3_ac226c77a248.png?sw=540&sh=540&sm=fit&q=80', 'https://www.nike.sa/dw/image/v2/BDVB_PRD/on/demandware.static/-/Sites-akeneo-master-catalog/default/dweb27a88f/nk/ae0/1/0/b/d/e/ae010bde_4529_4ef1_82ec_0c72b8edd49b.png?sw=540&sh=540&sm=fit&q=80', 'https://www.nike.sa/dw/image/v2/BDVB_PRD/on/demandware.static/-/Sites-akeneo-master-catalog/default/dw8012022c/nk/a27/a/3/e/1/4/a27a3e14_7857_4718_ace2_83b9d94d48f5.png?sw=540&sh=540&sm=fit&q=80']","Celebrate the legendary career of ""His Airness"" with the Jordan 6 Rings. Incorporating key features of each shoe worn during the championship series, it has premium details and lightweight, low-profile Zoom Air cushioning that delivers a responsive feel underfoot.","['Zoom Air units in the heel and forefoot provide lightweight, responsive cushioning.', 'Leather, synthetic leather and/or textile materials in the upper for comfort and durability.', 'Foam midsole for stability and lightweight cushioning.', 'Rubber outsole offers durability and traction.', 'Heel tab for easy on and off.']","['Colour Shown: White/Black/Lucky Green', 'Style: 322992-131']",,"['https://www.nike.sa/dw/image/v2/BDVB_PRD/on/demandware.static/-/Sites-akeneo-master-catalog/default/dwdbdf361b/nk/bba/a/1/5/2/4/bbaa1524_bbfe_4102_b3e8_268fd8888da7.png?sw=520&sh=520&sm=fit', 'https://www.nike.sa/dw/image/v2/BDVB_PRD/on/demandware.static/-/Sites-akeneo-master-catalog/default/dw05df22bb/nk/5da/5/8/6/8/c/5da5868c_07b3_4772_a2b4_032e779540af.png?sw=520&sh=520&sm=fit', 'https://www.nike.sa/dw/image/v2/BDVB_PRD/on/demandware.static/-/Sites-akeneo-master-catalog/default/dwf02b06a6/nk/5f1/0/b/c/e/4/5f10bce4_de9e_4f55_ba4c_c5a06799aa0f.png?sw=520&sh=520&sm=fit']"
199,Nike Renew Elevate 3,Basketball Shoes,SAR 500.00,"['https://www.nike.sa/dw/image/v2/BDVB_PRD/on/demandware.static/-/Sites-akeneo-master-catalog/default/dwd1b4ba5c/nk/a31/4/d/6/5/d/a314d65d_14c4_4cf2_b59c_92a2d5cbe4ff.png?sw=540&sh=540&sm=fit&q=80', 'https://www.nike.sa/dw/image/v2/BDVB_PRD/on/demandware.static/-/Sites-akeneo-master-catalog/default/dw29560c11/nk/904/0/9/7/1/9/90409719_eeab_42fb_8803_afc33212672c.png?sw=540&sh=540&sm=fit&q=80', 'https://www.nike.sa/dw/image/v2/BDVB_PRD/on/demandware.static/-/Sites-akeneo-master-catalog/default/dw9cf813f0/nk/f57/c/0/8/a/4/f57c08a4_8b88_4c95_9597_118e58e4442b.png?sw=540&sh=540&sm=fit&q=80', 'https://www.nike.sa/dw/image/v2/BDVB_PRD/on/demandware.static/-/Sites-akeneo-master-catalog/default/dwf257901d/nk/842/d/f/e/3/d/842dfe3d_cb5c_4e5b_b2b6_46928151d2dd.png?sw=540&sh=540&sm=fit&q=80', 'https://www.nike.sa/dw/image/v2/BDVB_PRD/on/demandware.static/-/Sites-akeneo-master-catalog/default/dw0b7940b9/nk/424/8/2/f/5/c/42482f5c_c69b_4373_9cd8_c0789f3a5a87.png?sw=540&sh=540&sm=fit&q=80']","Level up your game on both ends of the floor in the Nike Renew Elevate 3. Specifically tuned for 2-way players who want to make an impact offensively and defensively, this shoe helps you optimise your ability with all-game, all-season support and stability. Improved traction and arch support enhance cutting and pivoting, which can make the difference down the stretch.","['Structured mesh in the upper feels plush around your foot. It fits snugly to help reduce in-shoe movement during play.', 'The padded collar is contoured to provide a precise fit and support around your ankle.']","['No-sew overlays', 'Foam midsole', 'Plush tongue', 'Colour Shown: Black/Anthracite/Brilliant Orange/Pink Spell', 'Style: DD9304-007']","A generative, athlete-tested traction allows for better pivoting around the forefoot, allowing you to feel more secure and locked in when spinning, stopping and starting.","['https://www.nike.sa/dw/image/v2/BDVB_PRD/on/demandware.static/-/Sites-akeneo-master-catalog/default/dwe8938343/nk/cb4/c/b/0/a/3/cb4cb0a3_298c_49c1_b0e4_0fe7a0e8507d.png?sw=520&sh=520&sm=fit', 'https://www.nike.sa/dw/image/v2/BDVB_PRD/on/demandware.static/-/Sites-akeneo-master-catalog/default/dwe2b18bfa/nk/860/7/d/e/1/4/8607de14_b1d3_4ff9_a5ba_e860b5e72ad5.png?sw=520&sh=520&sm=fit', 'https://www.nike.sa/dw/image/v2/BDVB_PRD/on/demandware.static/-/Sites-akeneo-master-catalog/default/dwecf7761b/nk/687/f/2/5/d/a/687f25da_d772_43fc_9f19_9bd8b24d0ef6.png?sw=520&sh=520&sm=fit']"
200,NikeCourt Zoom Vapor Cage 4 Rafa,Men's Hard Court Tennis Shoes,SAR 975.00,"['https://www.nike.sa/dw/image/v2/BDVB_PRD/on/demandware.static/-/Sites-akeneo-master-catalog/default/dw7ec290ae/nk/cf1/3/c/e/5/9/cf13ce59_95aa_4d46_8a15_3658b78c3df2.png?sw=540&sh=540&sm=fit&q=80', 'https://www.nike.sa/dw/image/v2/BDVB_PRD/on/demandware.static/-/Sites-akeneo-master-catalog/default/dwd269b307/nk/3a8/e/3/d/1/5/3a8e3d15_91b5_48a6_af43_8e5eab4e05fb.png?sw=540&sh=540&sm=fit&q=80', 'https://www.nike.sa/dw/image/v2/BDVB_PRD/on/demandware.static/-/Sites-akeneo-master-catalog/default/dw5e9e8d84/nk/8ad/8/2/8/4/a/8ad8284a_5034_494f_99dc_b11b2f37071a.png?sw=540&sh=540&sm=fit&q=80', 'https://www.nike.sa/dw/image/v2/BDVB_PRD/on/demandware.static/-/Sites-akeneo-master-catalog/default/dweb1abf49/nk/59c/b/a/5/c/f/59cba5cf_dd71_401e_bfa8_f14d63709c16.png?sw=540&sh=540&sm=fit&q=80', 'https://www.nike.sa/dw/image/v2/BDVB_PRD/on/demandware.static/-/Sites-akeneo-master-catalog/default/dwe226682e/nk/ebc/3/4/e/4/0/ebc34e40_8f40_4f4e_99de_1efe8b1cc7b3.png?sw=540&sh=540&sm=fit&q=80']","Innovated to withstand your toughest matches, this updated design puts flexible, durable materials exactly where they're needed most. Signature Rafael Nadal details let you rep your favourite player while you run the court.","['Stiff frame on the lateral side creates a stable feel during side-to-side movements.', '1/2-length sleeve gives you a sock-like fit.', 'Designed for use on hard court surfaces.']","['Removable insole', 'Colour Shown: White/Bright Cactus/Cobalt Bliss', 'Style: DD1579-102']","Celebrate your favourite player with Rafa's iconic Bull logo on the tongue and ""Rafa"" on the heel.","['https://www.nike.sa/dw/image/v2/BDVB_PRD/on/demandware.static/-/Sites-akeneo-master-catalog/default/dw763e387c/nk/88d/1/8/8/c/f/88d188cf_b8ce_4288_a49b_2bc4d174eb3c.png?sw=520&sh=520&sm=fit', 'https://www.nike.sa/dw/image/v2/BDVB_PRD/on/demandware.static/-/Sites-akeneo-master-catalog/default/dwa4fb03a6/nk/e1f/a/d/5/2/f/e1fad52f_45c3_42db_95a2_e1937b32ea0e.png?sw=520&sh=520&sm=fit']"
201,Nike Air Max 270,Men's Shoes,SAR 975.00,"['https://www.nike.sa/dw/image/v2/BDVB_PRD/on/demandware.static/-/Sites-akeneo-master-catalog/default/dw61c816d4/nk/460/e/8/e/0/9/460e8e09_460e_43a5_beef_3ae074855584.png?sw=540&sh=540&sm=fit&q=80', 'https://www.nike.sa/dw/image/v2/BDVB_PRD/on/demandware.static/-/Sites-akeneo-master-catalog/default/dw88ff1a2c/nk/4e0/8/3/d/7/e/4e083d7e_1738_47fb_abc6_e7131247e62f.png?sw=540&sh=540&sm=fit&q=80', 'https://www.nike.sa/dw/image/v2/BDVB_PRD/on/demandware.static/-/Sites-akeneo-master-catalog/default/dwdfb9f429/nk/e4f/3/9/4/9/f/e4f3949f_617b_4208_8460_aab5416c4b9e.png?sw=540&sh=540&sm=fit&q=80', 'https://www.nike.sa/dw/image/v2/BDVB_PRD/on/demandware.static/-/Sites-akeneo-master-catalog/default/dw7384920e/nk/b01/d/b/2/0/2/b01db202_ea95_4b94_a4c5_4f0fe2ca2540.png?sw=540&sh=540&sm=fit&q=80', 'https://www.nike.sa/dw/image/v2/BDVB_PRD/on/demandware.static/-/Sites-akeneo-master-catalog/default/dw4f16c083/nk/c2d/6/1/9/1/d/c2d6191d_658d_4eee_a9d1_eb1f0cd77fbc.png?sw=540&sh=540&sm=fit&q=80']","Legendary Air gets lifted. Our first lifestyle Air Max brings you style, comfort and a whole lot of Air. An extra-large window in the heel lets you show off one of our greatest innovations while experiencing plush cushioning. Add a lightweight upper, low-cut collar and fresh pops of colour and you've got the perfect kicks for everyday fun.","['Knit fabric on upper provides lightweight fit and airy feel to help your feet stay cool.', 'The Max Air unit in the heel delivers lasting comfort, while an extra-large Air window gives you bold style and a look at the cushioning that helps put bounce in your step.', 'Stretchy inner sleeve and bootie-like construction create a fit that feels oh-so personalised.', 'Foam midsole feels soft and comfortable.']","['Pull tab on heel', 'Rubber outsole', 'Colour Shown: White/University Blue/Deep Royal Blue/White', 'Style: FJ4230-100']","Revolutionary Air technology first made its way into Nike footwear in 1978. In 1987, the Air Max 1 debuted with visible Air technology in its heel, allowing fans more than just the feel of Air cushioning—suddenly they could see it. Since then, next-generation Air Max shoes have become a hit with athletes and collectors by offering striking colour combinations and reliable, lightweight cushioning.",[]
202,Nike Streetgato,Football Shoes,SAR 500.00,"['https://www.nike.sa/dw/image/v2/BDVB_PRD/on/demandware.static/-/Sites-akeneo-master-catalog/default/dwc7b2959e/nk/cad/d/6/2/6/e/cadd626e_a3bc_4858_85ee_1b6b43b5653c.png?sw=540&sh=540&sm=fit&q=80', 'https://www.nike.sa/dw/image/v2/BDVB_PRD/on/demandware.static/-/Sites-akeneo-master-catalog/default/dwbdb06a75/nk/da2/e/f/0/d/6/da2ef0d6_458d_44ee_873c_52473f332f46.png?sw=540&sh=540&sm=fit&q=80', 'https://www.nike.sa/dw/image/v2/BDVB_PRD/on/demandware.static/-/Sites-akeneo-master-catalog/default/dw65e557c3/nk/ebf/b/0/8/d/8/ebfb08d8_0d09_48da_bf4e_286aa778282f.png?sw=540&sh=540&sm=fit&q=80', 'https://www.nike.sa/dw/image/v2/BDVB_PRD/on/demandware.static/-/Sites-akeneo-master-catalog/default/dwe546704d/nk/cb4/9/f/6/3/3/cb49f633_80b9_4165_b027_85b9c63cc9f9.png?sw=540&sh=540&sm=fit&q=80', 'https://www.nike.sa/dw/image/v2/BDVB_PRD/on/demandware.static/-/Sites-akeneo-master-catalog/default/dw8aeef05f/nk/6d9/8/6/c/d/1/6d986cd1_7904_44bf_8427_b993a5498306.png?sw=540&sh=540&sm=fit&q=80']",Rule the streets in the Nike Streetgato.They blend performance details with streetwear flair so you can be ready to play at any moment.,['Rubber outsole'],['Redesigned outsole provides non-stop traction for small-sided games.'],Suede in the upper offers an everyday look whether you're playing on the street or keeping things casual.,"['https://www.nike.sa/dw/image/v2/BDVB_PRD/on/demandware.static/-/Sites-akeneo-master-catalog/default/dw81c9aafb/nk/353/a/e/d/a/3/353aeda3_ef9a_4766_bada_5e572644fe84.png?sw=520&sh=520&sm=fit', 'https://www.nike.sa/dw/image/v2/BDVB_PRD/on/demandware.static/-/Sites-akeneo-master-catalog/default/dw0a6f5b14/nk/ceb/6/a/e/1/1/ceb6ae11_361a_4ad5_bc44_668c9dc696e2.png?sw=520&sh=520&sm=fit']"
203,Nike Air More Uptempo '96,Men's Shoes,"SAR 1,100.00","['https://www.nike.sa/dw/image/v2/BDVB_PRD/on/demandware.static/-/Sites-akeneo-master-catalog/default/dw720eea79/nk/413/e/6/4/5/b/413e645b_2779_442f_bf43_2d5f9fb80802.png?sw=540&sh=540&sm=fit&q=80', 'https://www.nike.sa/dw/image/v2/BDVB_PRD/on/demandware.static/-/Sites-akeneo-master-catalog/default/dwb3a6eaa6/nk/be5/8/c/d/a/9/be58cda9_d442_4228_8698_35bc7503379a.png?sw=540&sh=540&sm=fit&q=80', 'https://www.nike.sa/dw/image/v2/BDVB_PRD/on/demandware.static/-/Sites-akeneo-master-catalog/default/dw0d6f702e/nk/729/a/c/5/e/d/729ac5ed_8cf8_4310_bafd_3dce129ef321.png?sw=540&sh=540&sm=fit&q=80', 'https://www.nike.sa/dw/image/v2/BDVB_PRD/on/demandware.static/-/Sites-akeneo-master-catalog/default/dw31e5485a/nk/41b/2/8/e/d/e/41b28ede_a93b_4c46_a885_bfa1bf85e5b8.png?sw=540&sh=540&sm=fit&q=80', 'https://www.nike.sa/dw/image/v2/BDVB_PRD/on/demandware.static/-/Sites-akeneo-master-catalog/default/dwf399de0f/nk/44b/2/9/4/c/a/44b294ca_c23e_4910_b2db_ce0a95e72a76.png?sw=540&sh=540&sm=fit&q=80']","More than perhaps any other silhouette, the Air More Uptempo encapsulates '90s basketball flavour at its finest. Big and loud, the unapologetic design represents a hybrid of style and innovation that made major waves when it debuted—and still turns heads today. This crafted take keeps its colours subtle with neutrals and pops of Metallic Silver. The iconic AIR graphic comes in high-contrast white for a little extra off-court flair. After all, ""a little extra"" is what these shoes do best.","['Real and synthetic leather upper is durable and delivers a classic feel—just like the original.', 'Originally designed for performance hoops, Max Air units in the forefoot, midfoot and heel add cushioning you have to feel to believe.', '3 elastic straps over the tongue help keep these kicks in place, whether you rock them laced or unlaced.', 'Rubber sole gives you durable traction.']","['Colour Shown: Photon Dust/White/Black/Metallic Silver', 'Style: FB3021-001']","The first of its kind, Nike Air technology absorbs impact for cushioning with every step. It's been built to help reduce the weight of the shoe without sacrificing performance, supporting both the athlete and the lifespan of the shoe.",[]
204,Nike Air Max 90,Men's Shoes,SAR 900.00,"['https://www.nike.sa/dw/image/v2/BDVB_PRD/on/demandware.static/-/Sites-akeneo-master-catalog/default/dwf1ac5b84/nk/a42/7/2/1/7/9/a4272179_a4cd_4487_80de_b124b042ccb9.png?sw=540&sh=540&sm=fit&q=80', 'https://www.nike.sa/dw/image/v2/BDVB_PRD/on/demandware.static/-/Sites-akeneo-master-catalog/default/dwf7ba7ff6/nk/df5/4/c/d/e/0/df54cde0_2bc8_4e9a_824b_2263f464ef9b.png?sw=540&sh=540&sm=fit&q=80', 'https://www.nike.sa/dw/image/v2/BDVB_PRD/on/demandware.static/-/Sites-akeneo-master-catalog/default/dwcf86e360/nk/748/6/6/6/a/a/748666aa_8d91_4e6e_be06_afaceda7a5d3.png?sw=540&sh=540&sm=fit&q=80', 'https://www.nike.sa/dw/image/v2/BDVB_PRD/on/demandware.static/-/Sites-akeneo-master-catalog/default/dw6e70eb24/nk/2a9/7/7/7/4/b/2a97774b_2afd_45c0_9ffb_35f5b64fef38.png?sw=540&sh=540&sm=fit&q=80', 'https://www.nike.sa/dw/image/v2/BDVB_PRD/on/demandware.static/-/Sites-akeneo-master-catalog/default/dw91afb7b9/nk/fb5/9/5/7/5/5/fb595755_cab2_4fba_b232_f8b1e07820f5.png?sw=540&sh=540&sm=fit&q=80']","Lace up and feel the legacy. Produced at the intersection of art, music and culture, this champion running shoe helped define the '90s. Worn by presidents, revolutionised through collabs and celebrated through rare colourways, its striking visuals, Waffle outsole and exposed Nike Air cushioning keep it alive and well.","['The textile upper with leather and synthetic overlays adds durability.', 'Originally designed for performance running, visible Nike Air cushioning puts the history of comfort beneath your feet.', 'Rubber Waffle outsole delivers durable traction and heritage style.', 'Padded, low-cut collar looks sleek and feels great.']","['Foam midsole', 'Colour Shown: Flat Pewter/Black/Obsidian/White', 'Style: DZ3522-002']","The '90s were a turning point in culture—art, music, fashion and sneakers. The Air Max was at the forefront of the movement. With even more exposed Air cushioning and a bold new colour affectionately dubbed as ""Infrared"", its revolutionised design helped the first 90 take on a life of its own. No longer just a running shoe, it solidified Air Max as a streetwear cornerstone.",[]
205,Nike Pegasus Turbo Next Nature SE,Men's Road Running Shoes,SAR 975.00,"['https://www.nike.sa/dw/image/v2/BDVB_PRD/on/demandware.static/-/Sites-akeneo-master-catalog/default/dwef8385ee/nk/e4a/3/3/9/5/0/e4a33950_e26e_4b8d_93c0_da799def7b2b.png?sw=540&sh=540&sm=fit&q=80', 'https://www.nike.sa/dw/image/v2/BDVB_PRD/on/demandware.static/-/Sites-akeneo-master-catalog/default/dwdc66acda/nk/03c/a/e/a/c/d/03caeacd_8780_4bd6_8753_2b9b4ada558c.png?sw=540&sh=540&sm=fit&q=80', 'https://www.nike.sa/dw/image/v2/BDVB_PRD/on/demandware.static/-/Sites-akeneo-master-catalog/default/dw46c3b8c9/nk/803/2/b/6/6/d/8032b66d_6be4_4e6d_8dd2_e8002b2699a3.png?sw=540&sh=540&sm=fit&q=80', 'https://www.nike.sa/dw/image/v2/BDVB_PRD/on/demandware.static/-/Sites-akeneo-master-catalog/default/dwcf3968db/nk/e0c/1/0/4/5/2/e0c10452_deb9_4d13_8bd9_488499850c66.png?sw=540&sh=540&sm=fit&q=80', 'https://www.nike.sa/dw/image/v2/BDVB_PRD/on/demandware.static/-/Sites-akeneo-master-catalog/default/dw659f4f4d/nk/0d5/3/9/c/2/7/0d539c27_e05a_46dd_8d92_7d677232ab6f.png?sw=540&sh=540&sm=fit&q=80']","Let this esteemed stallion help you log the hard miles. Complete with lighter, responsive foam and a feathery upper, this motley-coloured mare helps you increase tempo without sacrificing comfort as you push towards a personal best. Sharp, bright hues complement dark-room colour neutrals, speaking to an inclusive world where digital and physical coexist in harmony.",['Waffle-inspired tread on the outsole provides traction.'],"['Colour Shown: Black/Green Abyss/Hyper Pink/Fuchsia Dream', 'Style: FB7183-001']","The more supportive the shoe, the more stability it can give to your natural stride. A combination of tuned support and intentionally placed cushioning helps you feel secure with every step. This Peg Turbo has neutral support. It gives you balance, whether you're a heel or a forefoot striker. It's good for long and short runs, too, providing a smooth transition from heel to toe.",[]
206,Nike React Vision,Men's Shoes,SAR 850.00,"['https://www.nike.sa/dw/image/v2/BDVB_PRD/on/demandware.static/-/Sites-akeneo-master-catalog/default/dwdc37481b/nk/739/3/d/1/7/6/7393d176_146e_45d2_92ae_26ef78a50b8d.png?sw=540&sh=540&sm=fit&q=80', 'https://www.nike.sa/dw/image/v2/BDVB_PRD/on/demandware.static/-/Sites-akeneo-master-catalog/default/dweeb0093a/nk/2aa/0/b/8/c/0/2aa0b8c0_c095_4b6b_b309_13035caabc00.png?sw=540&sh=540&sm=fit&q=80', 'https://www.nike.sa/dw/image/v2/BDVB_PRD/on/demandware.static/-/Sites-akeneo-master-catalog/default/dw542c4ed4/nk/5ad/9/5/8/f/b/5ad958fb_ccb9_492e_9fa1_09c19a89cfb4.png?sw=540&sh=540&sm=fit&q=80', 'https://www.nike.sa/dw/image/v2/BDVB_PRD/on/demandware.static/-/Sites-akeneo-master-catalog/default/dw0ea0c4ba/nk/56b/9/9/c/1/3/56b99c13_508c_4078_888b_f742a07184ea.png?sw=540&sh=540&sm=fit&q=80', 'https://www.nike.sa/dw/image/v2/BDVB_PRD/on/demandware.static/-/Sites-akeneo-master-catalog/default/dwbf9e37fe/nk/119/9/b/7/4/2/1199b742_29b6_45e3_809c_2c108a8d046f.png?sw=540&sh=540&sm=fit&q=80']","No matter where your explorations take you, the Nike React Vision is ready with undeniable style and surreal comfort. Layered textures and playful shapes come together in a design influenced by the exaggerated world of our dreams. Nike React foam and a padded tongue help provide dream-like cushioning for all your adventures—both real and imaginary.","['Inspired by the exaggerated world of our dreams, the design features micro-detailing, elongated proportions and multiple textures for an unforgettable appearance.', 'Nike React foam and a soft rubber outsole deliver lasting comfort from heel to toe.', 'A padded tongue provides additional cushioning.', 'The plastic heel clip helps secure the heel while providing structure and balance.']","['Heel and tongue pull tabs', 'Foam in midsole', 'Colour Shown: White/Deep Royal Blue/Photon Dust/University Blue', 'Style: FJ4231-100']",,[]
207,Nike Zoom Superfly Elite 2,Athletics Sprinting Spikes,"SAR 1,050.00","['https://www.nike.sa/dw/image/v2/BDVB_PRD/on/demandware.static/-/Sites-akeneo-master-catalog/default/dwcf6540ff/nk/d2f/2/7/8/f/f/d2f278ff_1f44_49cc_8979_92ec08e01743.png?sw=540&sh=540&sm=fit&q=80', 'https://www.nike.sa/dw/image/v2/BDVB_PRD/on/demandware.static/-/Sites-akeneo-master-catalog/default/dwc98f810b/nk/3fa/a/2/1/e/b/3faa21eb_7255_43af_952f_010f81d1a8e0.png?sw=540&sh=540&sm=fit&q=80', 'https://www.nike.sa/dw/image/v2/BDVB_PRD/on/demandware.static/-/Sites-akeneo-master-catalog/default/dwc61bb430/nk/a97/3/e/d/f/9/a973edf9_fe92_429f_b5c5_4aa44fc46f00.png?sw=540&sh=540&sm=fit&q=80', 'https://www.nike.sa/dw/image/v2/BDVB_PRD/on/demandware.static/-/Sites-akeneo-master-catalog/default/dw748574a6/nk/774/8/f/f/3/e/7748ff3e_8662_42a9_b27b_291b4e39f710.png?sw=540&sh=540&sm=fit&q=80', 'https://www.nike.sa/dw/image/v2/BDVB_PRD/on/demandware.static/-/Sites-akeneo-master-catalog/default/dw73554238/nk/4c6/f/8/c/e/9/4c6f8ce9_7679_4f57_9cb8_767c7828af85.png?sw=540&sh=540&sm=fit&q=80']","Training has taken you this far. Take it to the finish in the Nike Zoom Superfly Elite 2. Super light with a breathable feel, it's geared for runs from 100 to 400 metres. Removable pins on the outsole help keep your feet gripped to the track as you achieve breakaway speed. Lace up and fly!",['World Athletics-approved'],"['AtomKnit, an updated version of Flyknit, has a lightweight, contoured fit and enhanced breathability.']","The plate's design was created using data from hundreds of runners. The result is an outsole with increased stiffness and reduced weight. Peaks throughout the plate provide traction, giving your foot grip as you run around turns. It includes 8 removable stainless-steel pins to grip the track.",[]
