images_list,name,color,price,desc
"['https://cdn.shopify.com/s/files/1/2185/2813/products/M3204R_01_b1_s3_a1_1_m108_750x.jpg?v=1674603331', 'https://cdn.shopify.com/s/files/1/2185/2813/products/M3204R_01_b1_s3_a2_1_m108_750x.jpg?v=1674603330', 'https://cdn.shopify.com/s/files/1/2185/2813/products/M3204R_01_b1_s3_a3_1_m108_750x.jpg?v=1674603330', 'https://cdn.shopify.com/s/files/1/2185/2813/products/M3204R_01_b1_s3_a4_1_m108_750x.jpg?v=1674603329']",Torrent Overshirt,Navy,€‌165.00,"A must-have for transitional weather and every day. The Torrent Overshirt features a lightweight woven shell with a breathable jersey lining that’s perfect for layering on the go. Zippered front pockets, elastic cuffs and a relaxed fit seal the deal. Take it wherever you’re headed by layering it over a crew neck tee and a go-to pant."
"['https://cdn.shopify.com/s/files/1/2185/2813/products/M3204R_01_b1_s3_a1_1_m108_750x.jpg?v=1674603331', 'https://cdn.shopify.com/s/files/1/2185/2813/products/M3204R_01_b1_s3_a2_1_m108_750x.jpg?v=1674603330', 'https://cdn.shopify.com/s/files/1/2185/2813/products/M3204R_01_b1_s3_a3_1_m108_750x.jpg?v=1674603330', 'https://cdn.shopify.com/s/files/1/2185/2813/products/M3204R_01_b1_s3_a4_1_m108_750x.jpg?v=1674603329']",Torrent Overshirt,Gravel,€‌165.00,"A must-have for transitional weather and every day. The Torrent Overshirt features a lightweight woven shell with a breathable jersey lining that’s perfect for layering on the go. Zippered front pockets, elastic cuffs and a relaxed fit seal the deal. Take it wherever you’re headed by layering it over a crew neck tee and a go-to pant."
"['https://cdn.shopify.com/s/files/1/2185/2813/products/M3204R_01_b1_s3_a1_1_m108_750x.jpg?v=1674603331', 'https://cdn.shopify.com/s/files/1/2185/2813/products/M3204R_01_b1_s3_a2_1_m108_750x.jpg?v=1674603330', 'https://cdn.shopify.com/s/files/1/2185/2813/products/M3204R_01_b1_s3_a3_1_m108_750x.jpg?v=1674603330', 'https://cdn.shopify.com/s/files/1/2185/2813/products/M3204R_01_b1_s3_a4_1_m108_750x.jpg?v=1674603329']",Signature Overcoat,Core: Black,€‌280.00,"An elevated, slightly boxy statement done in street-ready, water-resistant ripstop woven fabric. The Signature Overcoat is a full length, wear-on-repeat look for all genders. It’s got that VIP-level cool factor."
"['https://cdn.shopify.com/s/files/1/2185/2813/products/M3204R_01_b1_s3_a1_1_m108_750x.jpg?v=1674603331', 'https://cdn.shopify.com/s/files/1/2185/2813/products/M3204R_01_b1_s3_a2_1_m108_750x.jpg?v=1674603330', 'https://cdn.shopify.com/s/files/1/2185/2813/products/M3204R_01_b1_s3_a3_1_m108_750x.jpg?v=1674603330', 'https://cdn.shopify.com/s/files/1/2185/2813/products/M3204R_01_b1_s3_a4_1_m108_750x.jpg?v=1674603329']",Co-Op Bomber,Core,€‌185.00,"The Co-Op Bomber is the classic, street-smart layer you can always count on. It’s made from lightweight woven fabric designed for comfort and versatility, with a water-repellant finish that protects against the elements. Fully zipped up or open layered over a cool tee, this relaxed bomber fit is ideal for everyday wear."
"['https://cdn.shopify.com/s/files/1/2185/2813/products/M3204R_01_b1_s3_a1_1_m108_750x.jpg?v=1674603331', 'https://cdn.shopify.com/s/files/1/2185/2813/products/M3204R_01_b1_s3_a2_1_m108_750x.jpg?v=1674603330', 'https://cdn.shopify.com/s/files/1/2185/2813/products/M3204R_01_b1_s3_a3_1_m108_750x.jpg?v=1674603330', 'https://cdn.shopify.com/s/files/1/2185/2813/products/M3204R_01_b1_s3_a4_1_m108_750x.jpg?v=1674603329']",Future Jacket,Black,€‌220.00,"The Future Jacket is just what you need to take you to & from all your plans, with on-point, vertical stitch detailing & a luxe, three-panel hood. Made from an epic, triple-layer memory woven fabric with a sleek nylon lining, this elevated, every-day staple features a bungee-closure hood, zippered front slash pockets & a clean finish. Layer up and get going."
"['https://cdn.shopify.com/s/files/1/2185/2813/products/M3204R_01_b1_s3_a1_1_m108_750x.jpg?v=1674603331', 'https://cdn.shopify.com/s/files/1/2185/2813/products/M3204R_01_b1_s3_a2_1_m108_750x.jpg?v=1674603330', 'https://cdn.shopify.com/s/files/1/2185/2813/products/M3204R_01_b1_s3_a3_1_m108_750x.jpg?v=1674603330', 'https://cdn.shopify.com/s/files/1/2185/2813/products/M3204R_01_b1_s3_a4_1_m108_750x.jpg?v=1674603329']",Co-Op Bomber,Core: Black,€‌185.00,"The Co-Op Bomber is the classic, street-smart layer you can always count on. It’s made from lightweight woven fabric designed for comfort and versatility, with a water-repellant finish that protects against the elements. Fully zipped up or open layered over a cool tee, this relaxed bomber fit is ideal for everyday wear."
"['https://cdn.shopify.com/s/files/1/2185/2813/products/M3204R_01_b1_s3_a1_1_m108_750x.jpg?v=1674603331', 'https://cdn.shopify.com/s/files/1/2185/2813/products/M3204R_01_b1_s3_a2_1_m108_750x.jpg?v=1674603330', 'https://cdn.shopify.com/s/files/1/2185/2813/products/M3204R_01_b1_s3_a3_1_m108_750x.jpg?v=1674603330', 'https://cdn.shopify.com/s/files/1/2185/2813/products/M3204R_01_b1_s3_a4_1_m108_750x.jpg?v=1674603329']",Repeat Running Jacket,Core,€‌165.00,"Studio. Street. Chill. Repeat. The Repeat Running Jacket, made from high-tech, ripstop fabric, is the perfect lightweight jacket for morning runs or making moves all day. A vented back gives extra airflow for comfort, while a 3-panel hood with Alo-logo bungee closure in the back keeps you covered. Two pockets hold all your essentials — plus, this weightless jacket compresses for convenient travel."
"['https://cdn.shopify.com/s/files/1/2185/2813/products/M3204R_01_b1_s3_a1_1_m108_750x.jpg?v=1674603331', 'https://cdn.shopify.com/s/files/1/2185/2813/products/M3204R_01_b1_s3_a2_1_m108_750x.jpg?v=1674603330', 'https://cdn.shopify.com/s/files/1/2185/2813/products/M3204R_01_b1_s3_a3_1_m108_750x.jpg?v=1674603330', 'https://cdn.shopify.com/s/files/1/2185/2813/products/M3204R_01_b1_s3_a4_1_m108_750x.jpg?v=1674603329']",VIP Blazer Trench,Athletic Heather Grey,€‌280.00,"You’ve reached VIP status. The VIP Blazer Trench is a full-length outerwear staple done in comfy, heavyweight fleece that keeps the core toasty in colder months. This blazer-inspired design features a single-button front opening, side-entry welt pockets and a relaxed fit meant for layering over other Alo essentials when hitting the streets."
"['https://cdn.shopify.com/s/files/1/2185/2813/products/M3204R_01_b1_s3_a1_1_m108_750x.jpg?v=1674603331', 'https://cdn.shopify.com/s/files/1/2185/2813/products/M3204R_01_b1_s3_a2_1_m108_750x.jpg?v=1674603330', 'https://cdn.shopify.com/s/files/1/2185/2813/products/M3204R_01_b1_s3_a3_1_m108_750x.jpg?v=1674603330', 'https://cdn.shopify.com/s/files/1/2185/2813/products/M3204R_01_b1_s3_a4_1_m108_750x.jpg?v=1674603329']",Legend Jacket,Core: Black,€‌235.00,"Ready to take the #1 spot in your closet. The Legend Jacket is a lightweight, wear-on-repeat look for he, she & they, featuring memory woven fabric with light fill, sleek nylon lining, a front zipper with snaps, an iconic collar & front pocket. A round, shoelace drawcord at the bottom, a back locker loop, cinched cuffs and zippered pockets complete the look. Wear it solo or as a head-to-toe statement with the Legend Snap Pant."
"['https://cdn.shopify.com/s/files/1/2185/2813/products/M3204R_01_b1_s3_a1_1_m108_750x.jpg?v=1674603331', 'https://cdn.shopify.com/s/files/1/2185/2813/products/M3204R_01_b1_s3_a2_1_m108_750x.jpg?v=1674603330', 'https://cdn.shopify.com/s/files/1/2185/2813/products/M3204R_01_b1_s3_a3_1_m108_750x.jpg?v=1674603330', 'https://cdn.shopify.com/s/files/1/2185/2813/products/M3204R_01_b1_s3_a4_1_m108_750x.jpg?v=1674603329']",Stride Jacket,Olive Branch Camouflage,€‌220.00,"Gear up and go in the street-ready Stride Jacket. It has a sleek, lightweight fabrication, camo print, side-zip pockets and open pockets at front. An adjustable bungee waist and elastic cuffs help lock in heat, so you can stay comfortable to-and-from.  "
"['https://cdn.shopify.com/s/files/1/2185/2813/products/M3204R_01_b1_s3_a1_1_m108_750x.jpg?v=1674603331', 'https://cdn.shopify.com/s/files/1/2185/2813/products/M3204R_01_b1_s3_a2_1_m108_750x.jpg?v=1674603330', 'https://cdn.shopify.com/s/files/1/2185/2813/products/M3204R_01_b1_s3_a3_1_m108_750x.jpg?v=1674603330', 'https://cdn.shopify.com/s/files/1/2185/2813/products/M3204R_01_b1_s3_a4_1_m108_750x.jpg?v=1674603329']",Legend Jacket,Core: Bone,€‌235.00,"Ready to take the #1 spot in your closet. The Legend Jacket is a lightweight, wear-on-repeat look for he, she & they, featuring memory woven fabric with light fill, sleek nylon lining, a front zipper with snaps, an iconic collar & front pocket. A round, shoelace drawcord at the bottom, a back locker loop, cinched cuffs and zippered pockets complete the look. Wear it solo or as a head-to-toe statement with the Legend Snap Pant."
"['https://cdn.shopify.com/s/files/1/2185/2813/products/M3204R_01_b1_s3_a1_1_m108_750x.jpg?v=1674603331', 'https://cdn.shopify.com/s/files/1/2185/2813/products/M3204R_01_b1_s3_a2_1_m108_750x.jpg?v=1674603330', 'https://cdn.shopify.com/s/files/1/2185/2813/products/M3204R_01_b1_s3_a3_1_m108_750x.jpg?v=1674603330', 'https://cdn.shopify.com/s/files/1/2185/2813/products/M3204R_01_b1_s3_a4_1_m108_750x.jpg?v=1674603329']",Sherpa Stage Puffer,Black,€‌270.00,"The moment temps begin to drop, reach for the Sherpa Stage Puffer. It’s an ultra-warm, structured puffer jacket fully lined in our cozy, premium sherpa fabric, with a full-zip closure and zippered  side pockets that keeps hands warmly insulated. Complete with a tall, stand-up collar, bundling up in this textured, fleecy favorite has never felt better."
"['https://cdn.shopify.com/s/files/1/2185/2813/products/M3204R_01_b1_s3_a1_1_m108_750x.jpg?v=1674603331', 'https://cdn.shopify.com/s/files/1/2185/2813/products/M3204R_01_b1_s3_a2_1_m108_750x.jpg?v=1674603330', 'https://cdn.shopify.com/s/files/1/2185/2813/products/M3204R_01_b1_s3_a3_1_m108_750x.jpg?v=1674603330', 'https://cdn.shopify.com/s/files/1/2185/2813/products/M3204R_01_b1_s3_a4_1_m108_750x.jpg?v=1674603329']",Oversized Sherpa Trench,Black,€‌350.00,"Sherpa & trench — a match for the ages. The full-length, classic trench silhouette gets reinvented for right now in our cozy, coveted sherpa, with an open front and zippered pockets to keep your stuff safe en route to-and-from."
"['https://cdn.shopify.com/s/files/1/2185/2813/products/M3204R_01_b1_s3_a1_1_m108_750x.jpg?v=1674603331', 'https://cdn.shopify.com/s/files/1/2185/2813/products/M3204R_01_b1_s3_a2_1_m108_750x.jpg?v=1674603330', 'https://cdn.shopify.com/s/files/1/2185/2813/products/M3204R_01_b1_s3_a3_1_m108_750x.jpg?v=1674603330', 'https://cdn.shopify.com/s/files/1/2185/2813/products/M3204R_01_b1_s3_a4_1_m108_750x.jpg?v=1674603329']",Corduroy Stage Puffer,Core: Black,€‌290.00,"Stand out and stay warm in the Corduroy Stage Puffer. It has a cozy, insulated body, padded corduroy exterior and zippered side pockets—a must for making the to-and-from as toasty as possible. A heavyweight, slightly oversized, wind-and-weather-proof coat worthy of your year-round rotation."
"['https://cdn.shopify.com/s/files/1/2185/2813/products/M3204R_01_b1_s3_a1_1_m108_750x.jpg?v=1674603331', 'https://cdn.shopify.com/s/files/1/2185/2813/products/M3204R_01_b1_s3_a2_1_m108_750x.jpg?v=1674603330', 'https://cdn.shopify.com/s/files/1/2185/2813/products/M3204R_01_b1_s3_a3_1_m108_750x.jpg?v=1674603330', 'https://cdn.shopify.com/s/files/1/2185/2813/products/M3204R_01_b1_s3_a4_1_m108_750x.jpg?v=1674603329']",Ripstop 1/4 Zip On-Set Jacket,Core: Black,€‌175.00,"Keep it top-notch from the top down with the Ripstop ¼ Zip On-Set Jacket, made from high-tech, water-resistant ripstop fabric. A bungee drawcord easily locks in heat in cooler weather while the handy front pocket keeps small essentials secure at the gym or on the streets. Lightweight, on-point and perfect for on-the-go when paired with performance bottoms."
"['https://cdn.shopify.com/s/files/1/2185/2813/products/M3204R_01_b1_s3_a1_1_m108_750x.jpg?v=1674603331', 'https://cdn.shopify.com/s/files/1/2185/2813/products/M3204R_01_b1_s3_a2_1_m108_750x.jpg?v=1674603330', 'https://cdn.shopify.com/s/files/1/2185/2813/products/M3204R_01_b1_s3_a3_1_m108_750x.jpg?v=1674603330', 'https://cdn.shopify.com/s/files/1/2185/2813/products/M3204R_01_b1_s3_a4_1_m108_750x.jpg?v=1674603329']",Stretch Woven Street Puffer,Core: Black,€‌270.00,"Don’t let the cool weather hold you back. The Stretch Woven Street Puffer is equipped to handle changing temps with a warm-and-cozy lightweight body, front full-zip closure, handy pockets and a street-ready fit. Layer it over a long sleeve or hoodie and get moving."
"['https://cdn.shopify.com/s/files/1/2185/2813/products/M3204R_01_b1_s3_a1_1_m108_750x.jpg?v=1674603331', 'https://cdn.shopify.com/s/files/1/2185/2813/products/M3204R_01_b1_s3_a2_1_m108_750x.jpg?v=1674603330', 'https://cdn.shopify.com/s/files/1/2185/2813/products/M3204R_01_b1_s3_a3_1_m108_750x.jpg?v=1674603330', 'https://cdn.shopify.com/s/files/1/2185/2813/products/M3204R_01_b1_s3_a4_1_m108_750x.jpg?v=1674603329']",Signature Overcoat,Core,€‌280.00,"An elevated, slightly boxy statement done in street-ready, water-resistant ripstop woven fabric. The Signature Overcoat is a full length, wear-on-repeat look for all genders. It’s got that VIP-level cool factor."
"['https://cdn.shopify.com/s/files/1/2185/2813/products/M3204R_01_b1_s3_a1_1_m108_750x.jpg?v=1674603331', 'https://cdn.shopify.com/s/files/1/2185/2813/products/M3204R_01_b1_s3_a2_1_m108_750x.jpg?v=1674603330', 'https://cdn.shopify.com/s/files/1/2185/2813/products/M3204R_01_b1_s3_a3_1_m108_750x.jpg?v=1674603330', 'https://cdn.shopify.com/s/files/1/2185/2813/products/M3204R_01_b1_s3_a4_1_m108_750x.jpg?v=1674603329']",Corduroy Stage Puffer,Core,€‌290.00,"Stand out and stay warm in the Corduroy Stage Puffer. It has a cozy, insulated body, padded corduroy exterior and zippered side pockets—a must for making the to-and-from as toasty as possible. A heavyweight, slightly oversized, wind-and-weather-proof coat worthy of your year-round rotation."
"['https://cdn.shopify.com/s/files/1/2185/2813/products/M3204R_01_b1_s3_a1_1_m108_750x.jpg?v=1674603331', 'https://cdn.shopify.com/s/files/1/2185/2813/products/M3204R_01_b1_s3_a2_1_m108_750x.jpg?v=1674603330', 'https://cdn.shopify.com/s/files/1/2185/2813/products/M3204R_01_b1_s3_a3_1_m108_750x.jpg?v=1674603330', 'https://cdn.shopify.com/s/files/1/2185/2813/products/M3204R_01_b1_s3_a4_1_m108_750x.jpg?v=1674603329']",Stretch Woven Street Puffer,Core: Bone,€‌270.00,"Don’t let the cool weather hold you back. The Stretch Woven Street Puffer is equipped to handle changing temps with a warm-and-cozy lightweight body, front full-zip closure, handy pockets and a street-ready fit. Layer it over a long sleeve or hoodie and get moving."
"['https://cdn.shopify.com/s/files/1/2185/2813/products/M3204R_01_b1_s3_a1_1_m108_750x.jpg?v=1674603331', 'https://cdn.shopify.com/s/files/1/2185/2813/products/M3204R_01_b1_s3_a2_1_m108_750x.jpg?v=1674603330', 'https://cdn.shopify.com/s/files/1/2185/2813/products/M3204R_01_b1_s3_a3_1_m108_750x.jpg?v=1674603330', 'https://cdn.shopify.com/s/files/1/2185/2813/products/M3204R_01_b1_s3_a4_1_m108_750x.jpg?v=1674603329']",Stretch Woven Street Puffer,Core,€‌270.00,"Don’t let the cool weather hold you back. The Stretch Woven Street Puffer is equipped to handle changing temps with a warm-and-cozy lightweight body, front full-zip closure, handy pockets and a street-ready fit. Layer it over a long sleeve or hoodie and get moving."
"['https://cdn.shopify.com/s/files/1/2185/2813/products/M3204R_01_b1_s3_a1_1_m108_750x.jpg?v=1674603331', 'https://cdn.shopify.com/s/files/1/2185/2813/products/M3204R_01_b1_s3_a2_1_m108_750x.jpg?v=1674603330', 'https://cdn.shopify.com/s/files/1/2185/2813/products/M3204R_01_b1_s3_a3_1_m108_750x.jpg?v=1674603330', 'https://cdn.shopify.com/s/files/1/2185/2813/products/M3204R_01_b1_s3_a4_1_m108_750x.jpg?v=1674603329']",Ripstop 1/4 Zip On-Set Jacket,Core,€‌175.00,"Keep it top-notch from the top down with the Ripstop ¼ Zip On-Set Jacket, made from high-tech, water-resistant ripstop fabric. A bungee drawcord easily locks in heat in cooler weather while the handy front pocket keeps small essentials secure at the gym or on the streets. Lightweight, on-point and perfect for on-the-go when paired with performance bottoms."
"['https://cdn.shopify.com/s/files/1/2185/2813/products/M3204R_01_b1_s3_a1_1_m108_750x.jpg?v=1674603331', 'https://cdn.shopify.com/s/files/1/2185/2813/products/M3204R_01_b1_s3_a2_1_m108_750x.jpg?v=1674603330', 'https://cdn.shopify.com/s/files/1/2185/2813/products/M3204R_01_b1_s3_a3_1_m108_750x.jpg?v=1674603330', 'https://cdn.shopify.com/s/files/1/2185/2813/products/M3204R_01_b1_s3_a4_1_m108_750x.jpg?v=1674603329']",Stunner Puffer Jacket,Ivory,€‌585.00,"This is what the future of fashion looks like — luxe, jaw-dropping, perfectly structured & so elevated. The Stunner Puffer Jacket attracts endless admiration & compliments, thanks to super-glossy, lightweight woven fabric and bungees at the hood, waist & sleeves for just-right contouring. A structured hood & high front collar perfectly frame the face and elevated seam details complete the look."
"['https://cdn.shopify.com/s/files/1/2185/2813/products/M3204R_01_b1_s3_a1_1_m108_750x.jpg?v=1674603331', 'https://cdn.shopify.com/s/files/1/2185/2813/products/M3204R_01_b1_s3_a2_1_m108_750x.jpg?v=1674603330', 'https://cdn.shopify.com/s/files/1/2185/2813/products/M3204R_01_b1_s3_a3_1_m108_750x.jpg?v=1674603330', 'https://cdn.shopify.com/s/files/1/2185/2813/products/M3204R_01_b1_s3_a4_1_m108_750x.jpg?v=1674603329']",Knock Out Faux Fur Jacket,Chocolate,€‌435.00,"There are no words for how cool this look is, but we’ll try: the Knock Out Faux Fur Jacket is an instant icon, courtesy of luxe faux fur and faux leather inset design. Welt zip pockets keep your stuff secure and a sleek, satin-like lining completes the look."
"['https://cdn.shopify.com/s/files/1/2185/2813/products/M3204R_01_b1_s3_a1_1_m108_750x.jpg?v=1674603331', 'https://cdn.shopify.com/s/files/1/2185/2813/products/M3204R_01_b1_s3_a2_1_m108_750x.jpg?v=1674603330', 'https://cdn.shopify.com/s/files/1/2185/2813/products/M3204R_01_b1_s3_a3_1_m108_750x.jpg?v=1674603330', 'https://cdn.shopify.com/s/files/1/2185/2813/products/M3204R_01_b1_s3_a4_1_m108_750x.jpg?v=1674603329']",Stunner Puffer Jacket,Black,€‌585.00,"This is what the future of fashion looks like — luxe, jaw-dropping, perfectly structured & so elevated. The Stunner Puffer Jacket attracts endless admiration & compliments, thanks to super-glossy, lightweight woven fabric and bungees at the hood, waist & sleeves for just-right contouring. A structured hood & high front collar perfectly frame the face and elevated seam details complete the look."
"['https://cdn.shopify.com/s/files/1/2185/2813/products/M3204R_01_b1_s3_a1_1_m108_750x.jpg?v=1674603331', 'https://cdn.shopify.com/s/files/1/2185/2813/products/M3204R_01_b1_s3_a2_1_m108_750x.jpg?v=1674603330', 'https://cdn.shopify.com/s/files/1/2185/2813/products/M3204R_01_b1_s3_a3_1_m108_750x.jpg?v=1674603330', 'https://cdn.shopify.com/s/files/1/2185/2813/products/M3204R_01_b1_s3_a4_1_m108_750x.jpg?v=1674603329']",Knock Out Faux Fur Jacket,Black,€‌435.00,"There are no words for how cool this look is, but we’ll try: the Knock Out Faux Fur Jacket is an instant icon, courtesy of luxe faux fur and faux leather inset design. Welt zip pockets keep your stuff secure and a sleek, satin-like lining completes the look."
"['https://cdn.shopify.com/s/files/1/2185/2813/products/M3204R_01_b1_s3_a1_1_m108_750x.jpg?v=1674603331', 'https://cdn.shopify.com/s/files/1/2185/2813/products/M3204R_01_b1_s3_a2_1_m108_750x.jpg?v=1674603330', 'https://cdn.shopify.com/s/files/1/2185/2813/products/M3204R_01_b1_s3_a3_1_m108_750x.jpg?v=1674603330', 'https://cdn.shopify.com/s/files/1/2185/2813/products/M3204R_01_b1_s3_a4_1_m108_750x.jpg?v=1674603329']",VIP Blazer Trench,Black,€‌280.00,"You’ve reached VIP status. The VIP Blazer Trench is a full-length outerwear staple done in comfy, heavyweight fleece that keeps the core toasty in colder months. This blazer-inspired design features a single-button front opening, side-entry welt pockets and a relaxed fit meant for layering over other Alo essentials when hitting the streets."
"['https://cdn.shopify.com/s/files/1/2185/2813/products/M3204R_01_b1_s3_a1_1_m108_750x.jpg?v=1674603331', 'https://cdn.shopify.com/s/files/1/2185/2813/products/M3204R_01_b1_s3_a2_1_m108_750x.jpg?v=1674603330', 'https://cdn.shopify.com/s/files/1/2185/2813/products/M3204R_01_b1_s3_a3_1_m108_750x.jpg?v=1674603330', 'https://cdn.shopify.com/s/files/1/2185/2813/products/M3204R_01_b1_s3_a4_1_m108_750x.jpg?v=1674603329']",Sherpa Stage Puffer,Camel,€‌270.00,"The moment temps begin to drop, reach for the Sherpa Stage Puffer. It’s an ultra-warm, structured puffer jacket fully lined in our cozy, premium sherpa fabric, with a full-zip closure and zippered  side pockets that keeps hands warmly insulated. Complete with a tall, stand-up collar, bundling up in this textured, fleecy favorite has never felt better."
"['https://cdn.shopify.com/s/files/1/2185/2813/products/M3204R_01_b1_s3_a1_1_m108_750x.jpg?v=1674603331', 'https://cdn.shopify.com/s/files/1/2185/2813/products/M3204R_01_b1_s3_a2_1_m108_750x.jpg?v=1674603330', 'https://cdn.shopify.com/s/files/1/2185/2813/products/M3204R_01_b1_s3_a3_1_m108_750x.jpg?v=1674603330', 'https://cdn.shopify.com/s/files/1/2185/2813/products/M3204R_01_b1_s3_a4_1_m108_750x.jpg?v=1674603329']",Corduroy Stage Puffer,Core: Bone,€‌290.00,"Stand out and stay warm in the Corduroy Stage Puffer. It has a cozy, insulated body, padded corduroy exterior and zippered side pockets—a must for making the to-and-from as toasty as possible. A heavyweight, slightly oversized, wind-and-weather-proof coat worthy of your year-round rotation."
"['https://cdn.shopify.com/s/files/1/2185/2813/products/M3204R_01_b1_s3_a1_1_m108_750x.jpg?v=1674603331', 'https://cdn.shopify.com/s/files/1/2185/2813/products/M3204R_01_b1_s3_a2_1_m108_750x.jpg?v=1674603330', 'https://cdn.shopify.com/s/files/1/2185/2813/products/M3204R_01_b1_s3_a3_1_m108_750x.jpg?v=1674603330', 'https://cdn.shopify.com/s/files/1/2185/2813/products/M3204R_01_b1_s3_a4_1_m108_750x.jpg?v=1674603329']",Repeat Running Jacket,Core: Gravel,€‌165.00,"Studio. Street. Chill. Repeat. The Repeat Running Jacket, made from high-tech, ripstop fabric, is the perfect lightweight jacket for morning runs or making moves all day. A vented back gives extra airflow for comfort, while a 3-panel hood with Alo-logo bungee closure in the back keeps you covered. Two pockets hold all your essentials — plus, this weightless jacket compresses for convenient travel."
"['https://cdn.shopify.com/s/files/1/2185/2813/products/M3204R_01_b1_s3_a1_1_m108_750x.jpg?v=1674603331', 'https://cdn.shopify.com/s/files/1/2185/2813/products/M3204R_01_b1_s3_a2_1_m108_750x.jpg?v=1674603330', 'https://cdn.shopify.com/s/files/1/2185/2813/products/M3204R_01_b1_s3_a3_1_m108_750x.jpg?v=1674603330', 'https://cdn.shopify.com/s/files/1/2185/2813/products/M3204R_01_b1_s3_a4_1_m108_750x.jpg?v=1674603329']",Ripstop 1/4 Zip On-Set Jacket,Core,€‌175.00,"Keep it top-notch from the top down with the Ripstop ¼ Zip On-Set Jacket, made from high-tech, water-resistant ripstop fabric. A bungee drawcord easily locks in heat in cooler weather while the handy front pocket keeps small essentials secure at the gym or on the streets. Lightweight, on-point and perfect for on-the-go when paired with performance bottoms."
"['https://cdn.shopify.com/s/files/1/2185/2813/products/M3204R_01_b1_s3_a1_1_m108_750x.jpg?v=1674603331', 'https://cdn.shopify.com/s/files/1/2185/2813/products/M3204R_01_b1_s3_a2_1_m108_750x.jpg?v=1674603330', 'https://cdn.shopify.com/s/files/1/2185/2813/products/M3204R_01_b1_s3_a3_1_m108_750x.jpg?v=1674603330', 'https://cdn.shopify.com/s/files/1/2185/2813/products/M3204R_01_b1_s3_a4_1_m108_750x.jpg?v=1674603329']",Oversized Faux Fur Trench,Ivory,€‌470.00,"The new, insanely soft & touchable Oversized Faux Fur Trench takes the beloved silhouette of our Oversized Sherpa Trench and remixed it in the softest faux fur you’ve ever felt, with an open front, zippered pockets, a notched collar and sleek, satiny lining. Keep this classic on hand all season long and layer over your fave hoodie for some street edge."
"['https://cdn.shopify.com/s/files/1/2185/2813/products/M3204R_01_b1_s3_a1_1_m108_750x.jpg?v=1674603331', 'https://cdn.shopify.com/s/files/1/2185/2813/products/M3204R_01_b1_s3_a2_1_m108_750x.jpg?v=1674603330', 'https://cdn.shopify.com/s/files/1/2185/2813/products/M3204R_01_b1_s3_a3_1_m108_750x.jpg?v=1674603330', 'https://cdn.shopify.com/s/files/1/2185/2813/products/M3204R_01_b1_s3_a4_1_m108_750x.jpg?v=1674603329']",Oversized Faux Fur Trench,Chocolate,€‌470.00,"The new, insanely soft & touchable Oversized Faux Fur Trench takes the beloved silhouette of our Oversized Sherpa Trench and remixed it in the softest faux fur you’ve ever felt, with an open front, zippered pockets, a notched collar and sleek, satiny lining. Keep this classic on hand all season long and layer over your fave hoodie for some street edge."
